"clbid","credits","crsid","department","description","enrolled","groupid","grouptype","instructors","learningmode","level","max","name","notes","number","offerings","pn","prerequisites","section","semester","status","term","title","type","year"
"0000105027","1.0","0000026217","HIST","This course introduces students to Mediterranean archaeological field techniques and methods such as survey, site identification, artifact processing and analysis, and site excavation. During afive-week summer session, students: visit museums in order to recognize artifacts and contextualize them in regional chronologies; practice and refine excavation and survey techniques; and critically examine how archaeological knowledge about the ancient Mediterranean is constructed and expressed. Counts toward ancient studies major.","0","","","Timothy R. Howe","S","200","999","Archaeological Methods","","202","","False","False","H","5","O","20155","Mediterranean Archaeology Field School","Research","2015"
"0000109545","1.0","0000000126","BIO","Students journey toward greater understanding of the human body through an integrated study of the structure of the body (anatomy) and how organs such as the brain, heart, and kidney perform their remarkable functions (physiology). The course is designed primarily for students intending careers in the health sciences. Students attend lectures plus one three-hour laboratory per week. Offered annually. Counts toward exercise science major, neuroscience concentration, and biomedical studies concentration (for students through class of 2016). Prerequisite: BIO 143, or BIO 150 and BIO 227, or BIO 125, or CH/BI 227.","10","0000000126","","Steven Cole","S","200","999","Human Anatomy & Physiology","Term dates for this course: July 18 - Aug 18.","243","{'day': 'Mo', 'end': '11:00', 'location': 'RNS 435', 'start': '09:00'};{'day': 'Tu', 'end': '11:00', 'location': 'RNS 435', 'start': '09:00'};{'day': 'We', 'end': '11:00', 'location': 'RNS 435', 'start': '09:00'};{'day': 'Th', 'end': '11:00', 'location': 'RNS 435', 'start': '09:00'}","False","BIO 143, or BIO 150 and BIO 227, or BIO 125, or CH/BI 227.","","5","O","20155","Human Anatomy and Physiology: Organs and Organ Systems","Research","2015"
"0000109546","0.0","0000000127","BIO","","10","0000000126","","Steven Cole","S","200","999","Human Anatomy & Physiology Lab","Term dates for this lab: July 18 - Aug 18.","243","{'day': 'Mo', 'end': '15:00', 'location': 'RNS 254', 'start': '12:00'};{'day': 'Tu', 'end': '15:00', 'location': 'RNS 254', 'start': '12:00'};{'day': 'We', 'end': '15:00', 'location': 'RNS 254', 'start': '12:00'}","False","False","","5","O","20155","","Lab","2015"
"0000109557","1.0","0000000194","CHEM","This course provides a sequential introduction to physical chemistry. Beginning with an introduction to statistical aspects of chemical equilibria, it explores the relationships between energy, entropy and equilibria (thermodynamics); oxidation-reduction reactions and electrochemistry; transitions between phases; and rates of reactions. Students attend three classes and one three-hour laboratory per week. Offered annually in the spring semester. Counts toward biomolecular science concentration. Prerequisite: CHEM 125, or CHEM 121 and CHEM 123 and MATH 119 or MATH 120 or permission of instructor.","8","0000000194","","Patrick N. Riley","S","100","999","Chemical Reactions","","126","{'day': 'Mo', 'end': '11:30', 'location': 'RNS 310', 'start': '10:00'};{'day': 'Tu', 'end': '11:30', 'location': 'RNS 310', 'start': '10:00'};{'day': 'We', 'end': '11:30', 'location': 'RNS 310', 'start': '10:00'};{'day': 'Th', 'end': '11:30', 'location': 'RNS 310', 'start': '10:00'};{'day': 'Fr', 'end': '11:30', 'location': 'RNS 310', 'start': '10:00'}","False","CHEM 125, or CHEM 121 and CHEM 123 and MATH 119 or MATH 120 or permission of instructor.","","5","O","20155","Energies and Rates of Chemical Reactions","Research","2015"
"0000109558","0.0","0000000195","CHEM","","8","0000000194","","Patrick N. Riley","S","100","999","Chemical Reactions Lab","","126","{'day': 'Mo', 'end': '16:00', 'location': 'RNS 355', 'start': '13:00'};{'day': 'We', 'end': '16:00', 'location': 'RNS 355', 'start': '13:00'}","False","False","","5","O","20155","","Lab","2015"
"0000109559","1.0","0000000197","CHEM","This course is a continuation of CHEM 247 topics. Chemistry 248 delves into the chemistry of functional groups, especially those that play a role in the reactivity of biomolecules such as carbohydrates, lipids, proteins ,and nucleic acids. Together, CHEM 247 and CHEM 248 provide a full treatment of introductory organic chemistry. Offered annually in the spring semester. Counts toward environmental studies major (natural science emphasis) and biomolecular science concentration. Prerequisite: CHEM 247 or permission of instructor.","20","0000000197","","Michael S. Hemenway","S","200","35","Organic Chemistry II","","248","{'day': 'Mo', 'end': '11:30', 'location': 'RNS 390', 'start': '10:00'};{'day': 'Tu', 'end': '11:30', 'location': 'RNS 390', 'start': '10:00'};{'day': 'We', 'end': '11:30', 'location': 'RNS 390', 'start': '10:00'};{'day': 'Th', 'end': '11:30', 'location': 'RNS 390', 'start': '10:00'};{'day': 'Fr', 'end': '11:30', 'location': 'RNS 390', 'start': '10:00'}","False","CHEM 247 or permission of instructor.","","5","O","20155","","Research","2015"
"0000109560","0.25","0000000200","CHEM","This course is a continuation of CHEM 253. Students gain more experience with techniques used in CHEM 253 and in addition use gas chromatographic/mass spectrometric analyses. Students attend one three-hour laboratory each week. P/N only. Offered annually in the spring semester. Counts toward environmental studies major (natural science emphasis) and biomolecular science concentration. Prerequisites: CHEM 253 and previous or concurrent registration in CHEM 248.","10","0000000197","","Stephanie R. Harstad","S","200","24","Synthesis Lab II","","254","{'day': 'Mo', 'end': '15:30', 'location': 'RNS 340', 'start': '12:30'};{'day': 'We', 'end': '15:30', 'location': 'RNS 340', 'start': '12:30'}","True","Prerequisites: CHEM 253 and previous or concurrent registration in CHEM 248.","A","5","C","20155","Synthesis Laboratory II","Lab","2015"
"0000109561","1.0","0000001327","SPAN","Students explore the diverse histories, circumstances, and contributions of Latinos in the U.S. by reading essays, news accounts, short fiction and autobiographies, and by viewing videos and TV broadcasts. They consolidate their language skills and continue to develop their ability to analyze and communicate in Spanish by writing compositions, making oral presentations, and engaging in interactive group activities. They also review Spanish structures difficult for speakers of English. Offered each semester. Prerequisite: SPAN 231or placement.","4","","","Kris A. Cropsey","S","200","999","Intermed Spanish II","","232","{'day': 'Mo', 'end': '11:30', 'location': 'TOH 214', 'start': '10:00'};{'day': 'Tu', 'end': '11:30', 'location': 'TOH 214', 'start': '10:00'};{'day': 'We', 'end': '11:30', 'location': 'TOH 214', 'start': '10:00'};{'day': 'Th', 'end': '11:30', 'location': 'TOH 214', 'start': '10:00'};{'day': 'Fr', 'end': '11:30', 'location': 'TOH 214', 'start': '10:00'}","False","SPAN 231or placement.","","5","O","20155","Intermediate Spanish II","Research","2015"
"0000109562","0.25","0000023391","WRIT","This course provides supplemental instruction in reading, writing, and critical thinking in conjunction with a designated course. Students practice reading course-specific texts, focusing writing topics, writing essay and short answer exams, developing research habits, indentifying and using discipline-specific sources, and writing for general and specific audiences. Supplemental assignments complement writing in the designated course. P/N only. May be repeated once with a different designated course. Prerequisite: concurrent enrollment in a designated full-credit course.","47","","R","Bridget A. Draxler","S","100","999","Top: Supplemental Writing","Course takes place from August 1 - 28.","109","{'day': 'Mo', 'end': '14:00', 'location': 'TOH 210', 'start': '13:00'};{'day': 'We', 'end': '14:00', 'location': 'TOH 210', 'start': '13:00'};{'day': 'Mo', 'end': '15:15', 'location': 'TOH 210', 'start': '14:15'};{'day': 'We', 'end': '15:15', 'location': 'TOH 210', 'start': '14:15'};{'day': 'Fr', 'end': '13:45', 'location': 'TOH 210', 'start': '12:45'};{'day': 'Fr', 'end': '15:00', 'location': 'TOH 210', 'start': '14:00'}","True","concurrent enrollment in a designated full-credit course.","","5","C","20155","Topics: Supplemental Writing","Topic","2015"
"0000109564","1.0","0000021392","ENGL","Students explore African literature as it has evolved from oral traditions like folktales and epics into fiction, poetry, and drama in written form. Topics studied might include literature of particular geographical areas, such as East Africa, a genre such as poetry, or the influence of western literature on that of Africa. Authors studied may include Chinua Achebe, J. M. Coetzee, Nadine Gordimer, Arthur Nortje, Wole Soyinka, Ngugi wa Thiong'o, and Alex La Guma. Prerequisite: FYW.","10","","R","Joseph L. Mbele","S","200","999","Top: African Literature","","206","{'day': 'Mo', 'end': '14:00', 'location': 'RML 420', 'start': '12:30'};{'day': 'Tu', 'end': '14:00', 'location': 'RML 420', 'start': '12:30'};{'day': 'We', 'end': '14:00', 'location': 'RML 420', 'start': '12:30'};{'day': 'Th', 'end': '14:00', 'location': 'RML 420', 'start': '12:30'};{'day': 'Fr', 'end': '14:00', 'location': 'RML 420', 'start': '12:30'}","False","FYW.","","5","O","20155","African Literature","Topic","2015"
"0000109565","1.0","0000001074","PHYS","This two-semester in-depth course addresses topics in classical and modern physics using algebra, geometry, and some calculus. The course is well-suited for students of biology or chemistry or for those desiring a thorough introduction beyond the high-school level.;Physics 125 explores the character of electric and magnetic forces and fields, then takes up the extended description of matter (vibrations, waves - sound and light). Finally, both particle and wave descriptions are shown to be necessary for discussing quantum mechanics and its application to atomic physics. One laboratory meeting per week. Offered annually in the spring semester. Prerequisites: MATH 119 or MATH 120 or equivalent and PHYS 124.","9","0000001074","","Todd Coleman","S","100","999","Principles Physics II","Class will meet July 18, 2016 - August 12, 2016.","125","{'day': 'Mo', 'end': '12:00', 'location': 'RNS 208', 'start': '10:00'};{'day': 'Tu', 'end': '12:00', 'location': 'RNS 208', 'start': '10:00'};{'day': 'We', 'end': '12:00', 'location': 'RNS 208', 'start': '10:00'};{'day': 'Th', 'end': '12:00', 'location': 'RNS 208', 'start': '10:00'};{'day': 'Fr', 'end': '12:00', 'location': 'RNS 208', 'start': '10:00'}","False","Prerequisites: MATH 119 or MATH 120 or equivalent and PHYS 124.","","5","O","20155","Principles of Physics II","Research","2015"
"0000109566","0.0","0000001075","PHYS","","9","0000001074","","Todd Coleman","S","100","999","Principles Physics II Lab","Class will meet July 18, 2016 - August 12, 2016.","125","{'day': 'Mo', 'end': '15:30', 'location': 'RNS 292', 'start': '13:00'};{'day': 'We', 'end': '15:30', 'location': 'RNS 292', 'start': '13:00'}","False","False","","5","O","20155","","Lab","2015"
"0000109568","1.0","0000024283","PSCI","This class aims to better understand the racial climate in the United States, and the implications for American politics. Differing analytical perspectives from political science are used to interpret the role of race. A central question is the degree to which ""post-racial"" is an appropriate description of the current era. Counts toward race and ethnic studies and American studies majors and race and ethnic studies concentration.","6","","R","Joshua Anderson","S","200","999","Race and Politics","","244","{'day': 'Mo', 'end': '14:00', 'location': 'RML 520', 'start': '12:30'};{'day': 'Tu', 'end': '14:00', 'location': 'RML 520', 'start': '12:30'};{'day': 'We', 'end': '14:00', 'location': 'RML 520', 'start': '12:30'};{'day': 'Th', 'end': '14:00', 'location': 'RML 520', 'start': '12:30'};{'day': 'Fr', 'end': '14:00', 'location': 'RML 520', 'start': '12:30'}","False","False","","5","O","20155","Race and American Politics","Research","2015"
"0000109569","1.0","0000027950","MUSIC","This course explores the history and evolution of rock music from rhythm and blues through the present. In addition to covering stylistic trends and significant artists, emphasis is placed on the analysis of rock styles and on the social contexts in which rock music has been and continues to be performed and received. No formal training in music is necessary. Offered during summer.","4","","R","David R. Castro","S","100","999","Rock Music: Style/Context","","134","{'day': 'Mo', 'end': '11:30', 'location': 'CHM 239', 'start': '10:00'};{'day': 'Tu', 'end': '11:30', 'location': 'CHM 239', 'start': '10:00'};{'day': 'We', 'end': '11:30', 'location': 'CHM 239', 'start': '10:00'};{'day': 'Th', 'end': '11:30', 'location': 'CHM 239', 'start': '10:00'};{'day': 'Fr', 'end': '11:30', 'location': 'CHM 239', 'start': '10:00'}","False","False","","5","O","20155","Rock Music: Style and Context","Research","2015"
"0000109772","1.0","0000027057","ID","This interdisciplinary, topics-based course explores contemporary issues in science with emphasis on developing students' understanding of scientific and quantitiative approaches to problem solving. Specific topics, ranging from environmental chemistry and public health to biomechanics and genetics, vary from year to year. Students attend nine hours of lectures or small group discussion sections, two to three hours of quantitative workshops,and four hours of laboratory per week. Does not count toward any major. The course is taught with WRIT 109. Offered annually during the summer. Prerequisite: acceptance into the Summer Bridge Program.","47","","R","Charles Jr. Umbanhowar;Mary Walczak","S","100","999","Explorations in Science","Course takes place from August 1 - 28.","150","{'day': 'Mo', 'end': '10:30', 'location': 'RNS 410', 'start': '08:30'};{'day': 'Tu', 'end': '10:30', 'location': 'RNS 410', 'start': '08:30'};{'day': 'We', 'end': '10:30', 'location': 'RNS 410', 'start': '08:30'};{'day': 'Th', 'end': '10:30', 'location': 'RNS 410', 'start': '08:30'};{'day': 'Fr', 'end': '10:30', 'location': 'RNS 410', 'start': '08:30'}","False","acceptance into the Summer Bridge Program.","","5","C","20155","","Research","2015"
"0000109773","1.0","0000000499","ID","This course provides an examination and application of the key content, skills, and perspectives of human geography. The lens of the geographer focuses on the spatial distribution of phenomena over the surface of the earth, asking the questions ""where?"" and ""why there?"". The practices and skills of geography are used to investigate a variety of issues in the Middle East, including environmental problems, the culture and management of sacred places, and the reasons for war and the need for peace. Counts toward environmental studies major (social science emphasis) and middle eastern studies concentration.","2","","","Robert W. McClure","S","200","999","Human Geography of the Middle East","","234","{'day': 'Mo', 'end': '14:00', 'location': 'TOH 214', 'start': '12:30'};{'day': 'Tu', 'end': '14:00', 'location': 'TOH 214', 'start': '12:30'};{'day': 'We', 'end': '14:00', 'location': 'TOH 214', 'start': '12:30'};{'day': 'Th', 'end': '14:00', 'location': 'TOH 214', 'start': '12:30'};{'day': 'Fr', 'end': '14:00', 'location': 'TOH 214', 'start': '12:30'}","False","False","","5","O","20155","","Research","2015"
"0000109774","1.0","0000024281","ID","This course prepares McNair Scholars for the rigors of academic writing. Because the enrolled students represent a variety of disciplines, this course serves as a general introduction to writing in research; it is not meant to replace discipline-specific research methods or writing courses. Students read scholarly literature in their disciplines, write a literature review, draft various sections of a research paper, and prepare for a formal poster presentation. Offered every summer.","12","","R","Heather Campbell","S","200","999","McNair Research Writing","Class will take place from May 31 - August 5.","237","","False","False","","5","C","20155","McNair Research Writing Across the Disciplines","Research","2015"
"0000109777","1.0","0000020060","REL","Nordic sagas and modern fantastic works pose important theological questions such as the nature of reality in fantasy, the Eucharist, honor, gift, the grotesque, evil, salvation in Christ, and life as a quest and pilgrimage. They also raise valuable problems about the relationship of Christian beliefs to cultural narratives. Students may read J.R.R. Tolkien's Lord of the Rings, G.K. Chesterton, and selected sagas, alongside theological writings. Offered periodically during Interim. Prerequisite: BTS-B.","10","","R","Gregory A. Walter","S","200","999","Quest of Ring/Grail/Cross","","238","{'day': 'Mo', 'end': '09:30', 'location': 'OM 110', 'start': '08:00'};{'day': 'Tu', 'end': '09:30', 'location': 'OM 110', 'start': '08:00'};{'day': 'We', 'end': '09:30', 'location': 'OM 110', 'start': '08:00'};{'day': 'Th', 'end': '09:30', 'location': 'OM 110', 'start': '08:00'};{'day': 'Fr', 'end': '09:30', 'location': 'OM 110', 'start': '08:00'}","False","BTS-B.","","5","O","20155","Quest of the Ring, the Grail, and the Cross","Research","2015"
"0000109778","1.0","0000001237","REL","The nature and boundaries of communities, as well as the quality of relationships within communities, are determined by theology as well as by social, political, and ethnic factors. Students examine the ways in which the world's religions, particularly Christianity, have interpreted each other's significance and truth claims and considers the ethical implications of these different responses. Prerequisite: BTS-T or permission of instructor.","7","","","Gregory A. Walter","S","200","999","Rel Pluralsm/Communit","","293","{'day': 'Mo', 'end': '11:30', 'location': 'OM 110', 'start': '10:00'};{'day': 'Tu', 'end': '11:30', 'location': 'OM 110', 'start': '10:00'};{'day': 'We', 'end': '11:30', 'location': 'OM 110', 'start': '10:00'};{'day': 'Th', 'end': '11:30', 'location': 'OM 110', 'start': '10:00'};{'day': 'Fr', 'end': '11:30', 'location': 'OM 110', 'start': '10:00'}","False","BTS-T or permission of instructor.","","5","O","20155","Religious Pluralism and the Nature of Community","Research","2015"
"0000109896","1.0","0000001289","SOAN","This course helps students explore the connections between society and their own lives. Students answer challenging questions such as ""Do we have a 'human nature'?,"" ""Why does social inequality exist?,"" ""What is race?,"" and ""How do societies change?"" In answering these questions students learn to develop a sociological imagination. In doing so they review the various research methods and theories that form the sociological tradition. This course is open to first-year students or students in certain accredited programs. Open to all students when taught during the summer. Offered each semester. Counts toward American studies major.","3","","","Ibtesam Al Atiyat","S","100","999","Intro to Sociology","","121","{'day': 'Mo', 'end': '09:30', 'location': 'RML 420', 'start': '08:00'};{'day': 'Tu', 'end': '09:30', 'location': 'RML 420', 'start': '08:00'};{'day': 'We', 'end': '09:30', 'location': 'RML 420', 'start': '08:00'};{'day': 'Th', 'end': '09:30', 'location': 'RML 420', 'start': '08:00'};{'day': 'Fr', 'end': '09:30', 'location': 'RML 420', 'start': '08:00'}","False","False","A","5","O","20155","Introduction to Sociology","Research","2015"
"0000109897","1.0","0000001289","SOAN","This course helps students explore the connections between society and their own lives. Students answer challenging questions such as ""Do we have a 'human nature'?,"" ""Why does social inequality exist?,"" ""What is race?,"" and ""How do societies change?"" In answering these questions students learn to develop a sociological imagination. In doing so they review the various research methods and theories that form the sociological tradition. This course is open to first-year students or students in certain accredited programs. Open to all students when taught during the summer. Offered each semester. Counts toward American studies major.","9","","","Ibtesam Al Atiyat","S","100","999","Intro to Sociology","","121","{'day': 'Mo', 'end': '11:30', 'location': 'RML 420', 'start': '10:00'};{'day': 'Tu', 'end': '11:30', 'location': 'RML 420', 'start': '10:00'};{'day': 'We', 'end': '11:30', 'location': 'RML 420', 'start': '10:00'};{'day': 'Th', 'end': '11:30', 'location': 'RML 420', 'start': '10:00'};{'day': 'Fr', 'end': '11:30', 'location': 'RML 420', 'start': '10:00'}","False","False","B","5","O","20155","Introduction to Sociology","Research","2015"
"0000110000","0.25","0000000153","BIO","Internships are designed to provide career-testing opportunities. Students interested in an internship should consult with the Piper Center for Vocation and Career, enlist a faculty supervisor, and complete an internship application. Internships do not count toward the biology major requirements.","1","","","Eric Cole","S","200","999","Academic Internship","","294","","True","False","","5","O","20155","","Research","2015"
"0000110061","0.25","0000000707","ID","","1","","","Susan E. Smalling","S","200","999","Academic Internship","","294","","True","False","","5","O","20155","","Research","2015"
"0000110066","1.0","0000001165","PSYCH","How do biological factors influence fundamental aspects of psychology and behavior? In this course, students learn about relationships between the brain and behavior and use neuroanatomical, physiological, and biochemical levels of analysis to understand basic behavioral processes and systems, including sensation, movement, emotion, sleep and arousal, hunger, motivation, learning, and psychopathology. Offered each semester. Counts toward biology major and neuroscience concentration and biomedical studies concentration (for students through class of 2016). Prerequisite: PSYCH 125 or BIO 123, BIO 227 or CH/BI 227.","0","","","Shelly D. Dickinson","S","200","999","Biopsychology","","238","{'day': 'Mo', 'end': '11:30', 'location': 'RNS 136', 'start': '10:00'};{'day': 'Tu', 'end': '11:30', 'location': 'RNS 136', 'start': '10:00'};{'day': 'We', 'end': '11:30', 'location': 'RNS 136', 'start': '10:00'};{'day': 'Th', 'end': '11:30', 'location': 'RNS 136', 'start': '10:00'};{'day': 'Fr', 'end': '11:30', 'location': 'RNS 136', 'start': '10:00'}","False","PSYCH 125 or BIO 123, BIO 227 or CH/BI 227.","","5","C","20155","","Research","2015"
"0000110080","0.5","0000000795","MEDIA","","1","","","Bill Sonnega","S","200","999","Academic Internship","","294","","True","False","","5","O","20155","","Research","2015"
"0000110138","0.25","0000000200","CHEM","This course is a continuation of CHEM 253. Students gain more experience with techniques used in CHEM 253 and in addition use gas chromatographic/mass spectrometric analyses. Students attend one three-hour laboratory each week. P/N only. Offered annually in the spring semester. Counts toward environmental studies major (natural science emphasis) and biomolecular science concentration. Prerequisites: CHEM 253 and previous or concurrent registration in CHEM 248.","8","0000000197","","Michael S. Hemenway","S","200","24","Synthesis Lab II","","254","{'day': 'Tu', 'end': '15:30', 'location': 'RNS 340', 'start': '12:30'};{'day': 'Th', 'end': '15:30', 'location': 'RNS 340', 'start': '12:30'}","True","Prerequisites: CHEM 253 and previous or concurrent registration in CHEM 248.","B","5","O","20155","Synthesis Laboratory II","Lab","2015"
"0000110155","0.25","0000000374","DANCE","","1","","","Heather J. Klopchin","S","200","999","Academic Internship","","294","","True","False","","5","O","20155","Internship","Research","2015"
"0000110156","0.25","0000000344","EDUC","","1","","","Heather Campbell","S","300","999","Academic Internship","","394","","True","False","","5","O","20155","","Research","2015"
"0000110159","1.0","0000000707","ID","","0","","","Katherine S. Tegtmeyer Pak","S","200","999","Academic Internship","","294","","True","False","A","5","O","20155","","Research","2015"
"0000110162","0.25","0000000961","NURS","Does not count toward the major. Students may choose a 1.00, 0.50, or 0.25 credit option.","3","","","Elizabeth Rodgers","S","300","999","Academic Internship","","394","","True","False","","5","O","20155","","Research","2015"
"0000110173","0.25","0000000961","NURS","Does not count toward the major. Students may choose a 1.00, 0.50, or 0.25 credit option.","3","","","Mary Beth Kuehn","S","300","999","Academic Internship","","394","","True","False","A","5","O","20155","","Research","2015"
"0000110174","1.0","0000000795","MEDIA","","1","","","Bill Sonnega","S","200","999","Academic Internship","","294","","True","False","A","5","O","20155","","Research","2015"
"0000110175","1.0","0000000276","ECON","","1","","","Xun Pomponio","S","200","999","Academic Internship","","294","","True","False","","5","O","20155","","Research","2015"
"0000110180","1.0","0000000299","CSCI","This is an intermediate-level version of CSCI 394.","1","","","Richard Brown","S","200","999","Academic Internship","","294","","True","False","","5","O","20155","","Research","2015"
"0000110184","0.25","0000000795","MEDIA","","12","","","Bill Sonnega","S","200","999","Academic Internship","","294","","True","False","B","5","O","20155","","Research","2015"
