"clbid","credits","crsid","department","description","enrolled","gereqs","groupid","instructors","learningmode","level","max","name","notes","number","offerings","pn","prerequisites","section","semester","status","term","title","type","year"
"0000146324","1.0","0000026712","BIO","The study of the anatomy and physiology of the human body is founded on a thorough understanding of the structure and function of cells and tissues. Students attend lectures plus one three-hour laboratory per week. Nursing and kinesiology majors may pre-register for this course. This course may not be taken after completion of CH/BI 227 or BIO 227. Offered in the fall semester. Also counts toward the kinesiology major.","13","NTS","0000026712","Steven Cole","S","100","24","Human Anatomy & Physiology I","Students in BIO 143 must also register for BIO 143 lab.","143","","False","False","","4","O","20214","Human Anatomy and Physiology: Cells and Tissues","Research","2021"
"0000146325","0.0","0000026713","BIO","","13","","0000026712","Steven Cole","S","100","24","Human Anatomy & Physiology I Lab","","143","","False","False","","4","O","20214","","Lab","2021"
"0000146326","1.0","0000000192","CHEM","This study of chemical stoichiometry, equilibrium, acid-base chemistry, coordination chemistry, and atomic and molecular structure supplies the fundamental background on which all later chemistry courses depend. It includes applications of equilibrium principles to acid-base chemistry. Students attend three classes and one three-hour laboratory per week. Students planning to continue in chemistry should consider concurrent registration in MATH 119 or MATH 120. The course cannot be taken in conjunction with or after credit in CHEM 121 or CHEM 122. Offered annually in the fall semester. Also counts toward biology major and biomolecular science concentration. Prerequisite: placement via online placement survey.","4","NTS","0000000192","Patrick N. Riley","S","100","24","Struct Chem & Equilib","Students in Chemistry 125 must also register for Chemistry 125 Lab.","125","{'day': 'Mo', 'end': '11:30', 'location': 'RNS 310', 'start': '10:00'};{'day': 'Tu', 'end': '11:30', 'location': 'RNS 310', 'start': '10:00'};{'day': 'We', 'end': '11:30', 'location': 'RNS 310', 'start': '10:00'};{'day': 'Th', 'end': '11:30', 'location': 'RNS 310', 'start': '10:00'};{'day': 'Fr', 'end': '11:30', 'location': 'RNS 310', 'start': '10:00'}","False","placement via online placement survey.","","4","O","20214","Structural Chemistry and Equilibrium","Research","2021"
"0000146327","0.0","0000000193","CHEM","","4","","0000000192","Patrick N. Riley","S","100","24","Struct Chem & Equilib Lab","","125","{'day': 'Mo', 'end': '16:00', 'location': 'RNS 355', 'start': '13:00'};{'day': 'We', 'end': '16:00', 'location': 'RNS 355', 'start': '13:00'}","False","False","","4","O","20214","","Lab","2021"
"0000146328","1.0","0000000196","CHEM","Organic chemistry is the study of compounds containing carbon, emphasizing the structures and mechanisms of reaction of these molecules. This course focuses on structure, nomenclature, and reactions of aliphatic and alicyclic compounds, including aspects of stereochemistry and spectroscopic identification of organic compounds. A full treatment of introductory organic chemistry requires subsequent enrollment in CHEM 248. Offered annually in the fall semester. Also counts toward biomolecular science concentration. Prerequisite: CHEM 126 or CH/BI 126 or permission of instructor.","9","","","Peter J. Gittins","S","200","24","Organic Chemistry I","Course dates are June 6 - July 8 (No Class July 4)","247","{'day': 'Mo', 'end': '12:00', 'location': 'RNS 390', 'start': '09:00'};{'day': 'We', 'end': '12:00', 'location': 'RNS 390', 'start': '09:00'};{'day': 'Fr', 'end': '12:00', 'location': 'RNS 390', 'start': '09:00'}","False","CHEM 126 or CH/BI 126 or permission of instructor.","","4","O","20214","","Research","2021"
"0000146329","0.25","0000000199","CHEM","This laboratory course introduces students to the synthesis and characterization of organic,organometallic and inorganic compounds and serves as a general introduction to green chemistry. Students purify the materials they produce by techniques such as chromatography and characterize them using optical rotation measurements, infrared spectroscopy, and nuclear magnetic resonance spectroscopy. Students attend one three-hour laboratory each week. P/N only. Offered annually in the fall semester. Also counts toward biomolecular science concentration. Prerequisite: previous or concurrent registration in CHEM 247.","8","","","Peter J. Gittins","S","200","24","Synthesis Lab I","Course dates are June 7 - July 7 (No Class July 4)","253","{'day': 'Tu', 'end': '12:30', 'location': 'RNS 340', 'start': '08:30'};{'day': 'Th', 'end': '12:30', 'location': 'RNS 340', 'start': '08:30'}","True","previous or concurrent registration in CHEM 247.","","4","O","20214","Synthesis Laboratory I","Lab","2021"
"0000146330","1.0","0000034973","CSCI","Students explore special topics in computer science. Topics may vary from year-to-year. May be repeated if topics are different. Offered periodically. Prerequisite: permission of instructor.","7","","","Sravya Kondrakunta","S","200","18","Top: Intro to Machine Learning","Topic: Introduction to Machine Learning.;Prerequisite: CSCI 221 or CSCI 251, or permission of instructor.","200","{'day': 'Mo', 'end': '11:30', 'location': 'RNS 203', 'start': '10:00'};{'day': 'Tu', 'end': '11:30', 'location': 'RNS 203', 'start': '10:00'};{'day': 'We', 'end': '11:30', 'location': 'RNS 203', 'start': '10:00'};{'day': 'Th', 'end': '11:30', 'location': 'RNS 203', 'start': '10:00'};{'day': 'Fr', 'end': '11:30', 'location': 'RNS 203', 'start': '10:00'}","False","permission of instructor.","","4","O","20214","Topics in Computer Science","Topic","2021"
"0000146332","1.0","0000021584","FMS","This course is an introduction to film analysis. Students learn the language used to describe and understand various features and aspects of the cinema. In addition to exploring the elements that make up a film, students also think carefully about the decisions, techniques, and strategies that inform film production. Topics of study include narrative, mise-en-scene, cinematography, editing, film sound, and, later in the course, broader categories of classification such as genre and mode.","10","CRE","","Björn Nordfjörd","A","100","24","Intro to Film Studies","","101","","False","False","","4","O","20214","Introduction to Film Studies","Research","2021"
"0000146333","1.0","0000026169","GSS","Required for the gender and sexuality studies major and concentration, this course introduces students to the concept of gender as a category of analysis. It is designed for students who seek a fuller understanding of themselves as women and men and a wider knowledge of the experiences and achievements of women. Offered each semester. Also counts toward educational studies concentration.","3","","","Andrea L. Schmidt","A","100","25","Intro Gender/Sexuality St","","121","","False","False","","4","O","20214","Introduction to Gender and Sexuality Studies","Research","2021"
"0000146335","0.25","0000001011","KINES","Students learn and apply the basic principles of fitness through a variety of aerobic activities.","9","ACB","","Kayla R. Hatting","S","100","25","Aerobics","","131","","False","False","B","4","O","20214","","Research","2021"
"0000146336","1.0","0000000939","NURS","This course explores the sources, chemical composition, and metabolic behavior of nutrients. Nutritional requirements for a balanced diet are examined as well as the consequences of excesses and deficiencies. Students use nutrition tools and guidelines to make sound food choices, learn how to read food labels, and consider factors affecting food consumption. Class activities increase students' awareness of a healthy diet, help students evaluate nutrition behaviors, and facilitate a nutritionally sound lifestyle. Offered annually. Does not count toward major, but is a prerequisite for the nursing major.","9","NTS","","Susan Huehn","A","100","30","Nutrition and Wellness","","110","","False","False","","4","O","20214","","Research","2021"
"0000146337","1.0","0000000982","PHIL","Valuing nature raises significant philosophical and ethical issues. This course considers the nature of animal life, the character and control of pollution, the conflict between preservationism and conservationism, corporate and governmental responsibility for the eco-crisis, the use of economic categories to assess wilderness areas and endangered species, the conflict between eco-holism and individualism, and the philosophy of wilderness management. Offered annually. Also counts toward environmental studies major (all emphases) and environmental studies and management studies concentrations.","3","ERC","","Alberto Urquidez","S","200","20","Environmental Ethics","","257","","False","False","","4","O","20214","","Research","2021"
"0000146339","1.0","0000001154","PSYCH","This whirlwind introduction comprehensively examines foundational principles, theoretical approaches, and major areas of study within psychology. Acting as skeptical scientists, students gain another lens on the human experience by which they can better understand themselves and others. Students see psychology as a science and challenge ""common sense"" explanations about how people function. This gateway course captures the essence of the liberal arts, applying to almost any career choice. Offered each semester. Also counts toward nursing, social studies education, and social work majors and educational studies concentration.","8","SCS","","Gary M. Muir","A","100","25","Principles: Psych","","125","","False","False","","4","O","20214","Principles of Psychology","Research","2021"
"0000146340","1.0","0000027687","REL","The death of God refers to the absence or non-existence of God in a post-Christian world. What happens after God has exited the scene? Is there only nature, humanity, or nothing at all? Students evaluate the challenges that the death of God has for thinking about God, the meaning and purpose of Jesus in such conditions, as well as religious belief, reason, and the secular by reading classical and contemporary theological work on the death of Jesus and the death of God. Offered periodically.","9","CTD","","Gregory A. Walter","S","200","25","The Death of God","","244","","False","False","","4","O","20214","Theology after the Death of God","Research","2021"
"0000146341","1.0","0000022445","REL","This course offers an intensive study of African-American religious thought with particular emphasis on the 20th century. Structured thematically, the course covers: African religious roots; religious thought with particular emphasis on ideas of suffering, redemption, salvation, and liberation; the relation between Christianity and other religious traditions; and Afrocentrism and Black Nationalism as interpretive and critical lenses of African-American religious experience.","5","CTD;PAR","","Timothy M. II. Rainey","S","200","25","African-American Religious Thought","","267","","False","False","","4","O","20214","African-American Religious Thought in the 20th Century","Research","2021"
"0000146343","1.0","0000001289","SOAN","This course helps students explore the connections between society and their own lives. Students answer challenging questions such as ""Do we have a 'human nature'?,"" ""Why does social inequality exist?,"" ""What is race?,"" and ""How do societies change?"" In answering these questions students learn to develop a sociological imagination. In doing so they review the various research methods and theories that form the sociological tradition. This course is open to first-year students or students in certain accredited programs. Open to all students when taught during the summer. Offered each semester. Also counts toward race and ethnic studies and gender and sexuality studies majors and gender and sexuality studies concentration.","4","PAR;SCS","","Sidonia Alenuma","S","100","15","Intro to Sociology","","121","","False","False","B","4","O","20214","Introduction to Sociology","Research","2021"
"0000146344","1.0","0000001403","STAT","A first course in statistical methods for scientists, this course addresses issues for proposing/designing an experiment, as well as exploratory and inferential techniques for analyzing and modeling scientific data. Topics include probability models, exploratory graphics, descriptive techniques, statistical designs, hypothesis testing, confidence intervals, and simple/multiple regression. Offered each semester. Enrollment limited for seniors. STAT 110, STAT 212, and ECON 260 all provide an introduction to statistics and students should not take more than one; they all can serve as a prerequisite for further courses. Also counts toward environmental studies major (natural science and social science emphases), kinesiology major, and management studies and mathematical biology concentrations.","7","QCR","","Joe Roith","S","200","25","Statistics for Science","","212","","False","False","","4","O","20214","Statistics for the Sciences","Research","2021"
"0000146400","1.0","0000000824","MUSIC","This course presents a study of the historical development of jazz, from its roots in blues and ragtime at the ""beginning"" of the 20th century to the present, focusing on its principal forms and styles, its role in American culture, and contributions of major artists. Offered periodically. Also counts toward race and ethnic studies major and Africa and the African Diaspora and race and ethnic studies concentrations.","7","CRE;PAR","","JC Sanford","S","200","30","History of Jazz","","231","","False","False","","4","O","20214","","Research","2021"
"0000146556","1.0","0000000322","EDUC","This course examines basic assumptions about social science, primal thought, feminism, humanities, history, post-modernism, and thematic social studies. Students pursue methodologies of structuring knowledge and the means of advancing knowledge in each discipline. Students learn how to relate their social studies subject matter to the total social studies curriculum. Offered annually in the spring semester. Prerequisite: EDUC 260 or EDUC 290 or permission of instructor.","4","ERC","","Robert W. McClure","S","300","20","Social Studies Perspectives","","334","","False","EDUC 260 or EDUC 290 or permission of instructor.","","4","O","20214","","Research","2021"
"0000146557","1.0","0000000499","ID","This course provides an examination and application of the key content, skills, and perspectives of human geography. The lens of the geographer focuses on the spatial distribution of phenomena over the surface of the earth, asking the questions ""where?"" and ""why there?"". The practices and skills of geography are used to investigate a variety of issues in the Middle East, including environmental problems, the culture and management of sacred places, and the reasons for war and the need for peace. Counts toward environmental studies major (social science emphasis) and Middle Eastern studies concentration.","5","GHS;SCS","","Robert W. McClure","S","200","25","Human Geography of the Middle East","","234","","False","False","","4","O","20214","","Research","2021"
"0000146560","1.0","0000001137","PSCI","The course examines continuity and change in Russian political culture. The institutions and politics between the Soviet and Post-Soviet periods under the leadership of Yeltsin and Putin are explored. The course considers Russia as an energy-exporting state. The varied political developments of former Soviet republics in Europe, the Caucasus and Central Asia are compared and contrasted. Also counts toward Russian area studies major and management studies concentration.","6","SCS","","Anthony Lott","A","200","24","Russian/Eurasian Politics","","282","","False","False","","4","O","20214","Russian and Eurasian Politics","Research","2021"
"0000146561","1.0","0000017196","PSCI","The goal of this course is to introduce students to the long tradition of debate concerning the nature and legitimacy of war. The course explores the reality of war, the revulsion of violence and the possibility of just war through texts ranging from Thucydides, Aquinas, and Walzer. The course explores contemporary debates in light of moral and empirical arguments learned.","8","","","Anthony Lott","A","100","30","The Problem of War","","119","","False","False","","4","O","20214","","Research","2021"
"0000146801","1.0","0000001394","THEAT","Prerequisite: at least three previous courses in department.","0","OEP","","Bryan Schmidt","S","200","0","Academic Internship","","294","","True","at least three previous courses in department.","A","4","C","20214","Academic Internships","Research","2021"
"0000146805","1.0","0000024281","WRIT","This course prepares McNair Scholars for the rigors of academic writing. Because the enrolled students represent a variety of disciplines, this course serves as a general introduction to writing in research; it is not meant to replace discipline-specific research methods or writing courses. Students read scholarly literature in their disciplines, write a literature review, draft various sections of a research paper, and prepare for a formal poster presentation. Offered every summer. Prerequisite: successful completion of First Year Seminar or Writing and Rhetoric.","6","WAC","","Jean C. Porterfield","S","200","7","McNair Research Writing","Course dates: May 31 to August 5.;Open only to McNair Scholars.","237","","False","successful completion of First Year Seminar or Writing and Rhetoric.","","4","O","20214","McNair Research Writing Across the Disciplines","Research","2021"
"0000146826","1.0","0000000175","BIO","Independent research is offered for students dedicated to an in-depth research experience. In conjunction with a faculty supervisor, a student conceives and performs a research project leading to the production of a major piece of work such as a research paper or poster presentation. Independent research requires permission of a supervisor and completion of an independent research form available at the Registrar's Office or its website.","1","","","Kim A. Kandl","S","300","0","IR/Lipid Droplet Bioinformatics","","398","","False","False","A","4","C","20214","Independent Research","Research","2021"
"0000146974","1.0","0000000541","GREEK","Third-semester Greek students translate selections from Plato's dialogues (Apology, Crito, Phaedo) while reviewing vocabulary, grammar, and syntax. Topics for class discussion include the life and death of Socrates and the significance of the dialogues as works of literature. Offered annually in the fall semester. Also counts toward linguistic studies concentration. Prerequisite: GREEK 112 or equivalent.","1","WLC","","Anne Groton","S","200","1","Intermediate Greek","This is a special offering.","231","","False","GREEK 112 or equivalent.","","4","C","20214","","Research","2021"
"0000147160","1.0","0000000866","MUSIC","","1","","","Therees Hibbard","S","300","0","IR/Underrepresented Conductors","","398","","False","False","A","4","C","20214","Independent Research","Research","2021"
"0000147177","1.0","0000001320","SOAN","","1","","","Marc David","S","300","0","IR/Antiracism Literature Review","","398","","False","False","A","4","C","20214","Independent Research","Research","2021"

