"clbid","credits","crsid","department","description","enrolled","firstyear","gereqs","groupid","grouptype","halfcredit","instructors","junior","learningmode","level","max","name","notes","number","offerings","pn","prerequisites","section","semester","senior","sophomore","status","term","title","type","year"
"0000159571","1.0","0000038373","ENGL","This course examines the ethical commitments of Renaissance literature and asks students to use works by Edmund Spenser, William Shakespeare, John Milton, and others to reflect on their own ethical decision-making. The course is constructed around two main areas of ethical concern that connect today's world to prior centuries: the good life, and political ethics of leadership. This course asks how these texts' ethical commitments can help us understand enduring ethical dilemmas. Prerequisite: WRIT 120 or equivalent.","28","","ERC","","","","Nancy Simpson-Younger","","S","200","30","Ethics and Renaissance Literature","","216","{'day': 'Mo', 'end': '13:50', 'location': 'RML 515', 'start': '12:55'};{'day': 'We', 'end': '13:50', 'location': 'RML 515', 'start': '12:55'};{'day': 'Fr', 'end': '13:50', 'location': 'RML 515', 'start': '12:55'}","False","WRIT 120 or equivalent.","","3","","","O","20243","","Research","2024"
"0000159677","1.0","0000000286","ECON","Selected topics to be announced. May be repeated if topics are different. Prerequisites: ECON 261 and/or ECON 262 (at the discretion of the instructor) and one of ECON 260 or ECON 263 or STAT 272, or permission of instructor.","21","0/0","","","","","Urbashi Mookerjee","","S","300","18","Sem: Industrial Organization","Open to juniors and seniors only.;Counts toward Quantitative Research requirement for Quantitative Economics;major.","399","{'day': 'Mo', 'end': '14:55', 'location': 'HH 522', 'start': '14:00'};{'day': 'We', 'end': '14:55', 'location': 'HH 522', 'start': '14:00'};{'day': 'Fr', 'end': '14:55', 'location': 'HH 522', 'start': '14:00'}","False","Prerequisites: ECON 261 and/or ECON 262 (at the discretion of the instructor) and one of ECON 260 or ECON 263 or STAT 272, or permission of instructor.","C","3","","1/0","C","20243","Seminar in Economics","Seminar","2024"
"0000159728","0.0","0000038633","EDUC","","12","","","0000000321","2","2","Courtney A. Humm","","S","300","14","Plan, Instruct, &  Assessment Lab","Taken concurrently with EDUC 330.;Meets only on April 9, 16, and 23.","330","{'day': 'We', 'end': '18:30', 'location': 'TOH 214', 'start': '16:00'}","False","False","B","3","","","O","20243","","Lab","2024"
"0000159729","1.0","0000000321","EDUC","In this course, students learn and practice principles of effective instruction and develop their own teaching style as they prepare to become full-time teachers. Topics include learning theory, teacher roles and responsibilities, planning, methods of instruction, assessment, and classroom management. Students apply skills in a required 20-hour field experience and concurrent enrollment in a lab section. Open to juniors and seniors. Offered each semester. Prerequisites: EDUC 295 and acceptance into the teacher education program.","13","","","0000000321","3","","Courtney A. Humm","","S","300","14","Planning, Instruction, & Assessment","Prerequisite: EDUC 295 and acceptance into the teacher education program.;20-hour field experience required (2 hours/week, M-F during the school day).;Students in EDUC 330 C must also register for EDUC 330 lab C.","330","{'day': 'Mo', 'end': '12:45', 'location': 'TOH 214', 'start': '11:50'};{'day': 'We', 'end': '12:45', 'location': 'TOH 214', 'start': '11:50'};{'day': 'Fr', 'end': '12:45', 'location': 'TOH 214', 'start': '11:50'}","False","Prerequisites: EDUC 295 and acceptance into the teacher education program.","C","3","","","O","20243","Planning, Instruction, and Assessment","Research","2024"
"0000159730","1.0","0000027326","RACE","Students apply interdisciplinary theories and methods to selected topics in race and ethnic studies. The course employs a discussion format, focusing on critical reading and literary texts. Offered in alternate years. May be repeated if topic is different.","19","1/4","CRE;PAR","","","","Lau M. Malaver","","S","200","22","Sem: Race, Gender, & Performance","Open to a limited number of first-year students.","250","{'day': 'Tu', 'end': '13:10', 'location': 'TOH 312', 'start': '11:45'};{'day': 'Th', 'end': '14:05', 'location': 'TOH 312', 'start': '12:45'}","False","False","","3","","","O","20243","Topical Seminar","Seminar","2024"
"0000159755","1.0","0000000582","HIST","This course is a survey of Mediterranean civilization from the early history of Italy through the Roman Republic and Empire. Language Across the Curriculum (LAC) course periodically available in Latin. Offered annually. Also counts toward ancient studies, classics, and Latin majors.","22","","GHS;WAC","","","","Timothy R. Howe","","S","200","22","Ancient: Rome","","204","{'day': 'Tu', 'end': '11:00', 'location': 'HH 501', 'start': '09:35'};{'day': 'Th', 'end': '10:50', 'location': 'HH 501', 'start': '09:30'}","False","False","","3","","","C","20243","","Research","2024"
"0000159756","1.0","0000019404","HIST","This course provides a comprehensive research opportunity, including an introduction to relevant background material, technical instruction, identification of a meaningful project, and data collection. The topic is determined by the faculty member in charge of the course and may relate to their research interests. Offered based on department decision. May be offered as a 1.00 credit course or .50 credit course. Prerequisite: determined by individual instructor.","12","","ERC","","","","Timothy R. Howe","","S","300","10","Res: Archaeological Res & Ethics","Registration by application","396","{'day': 'Mo', 'end': '21:00', 'location': 'HH 429', 'start': '18:00'}","False","determined by individual instructor.","","3","","","C","20243","Directed Undergraduate Research","Research","2024"
"0000159757","1.0","0000038386","REL","Ecospirituality asks how attention to distinct bioregions leads to a flourishing life. Amidst climate catastrophe, encountering wisdom across spiritual traditions helps students learn from place. This course focuses on Indigenous, Christian, Jewish, Buddhist, and Spiritual-but-Not-Religious practices in rural and urban environments; amidst plains, forests, prairies; submerged in streams, bogs, and big water. While marrying region to practice, students use data collection, storytelling, ritual, hand arts, food, and music to reflect upon their own ecospirituality.","22","","RFV;WAC","","","","Trish Zimmerman","","S","200","22","Ecospirituality Learning from Place","","234","{'day': 'Tu', 'end': '13:10', 'location': 'OM 240', 'start': '11:45'};{'day': 'Th', 'end': '14:05', 'location': 'OM 240', 'start': '12:45'}","False","False","B","3","","","C","20243","","Research","2024"
"0000159769","1.0","0000000638","HIST","This seminar covers varying topics in American history, depending upon the instructor. Recent topics have included ""Lincoln and his America,"" ""The American Revolution,"" and ""19th-Century American Political Culture."" May be repeated if topic is different. Offered most years.","19","","","","","","Steven C. Hahn","","S","300","20","Sem: The Early U.S. Republic","","370","{'day': 'Tu', 'end': '13:10', 'location': 'HH 205', 'start': '11:45'};{'day': 'Th', 'end': '14:05', 'location': 'HH 205', 'start': '12:45'}","False","False","","3","","","O","20243","Research Seminar: American History","Seminar","2024"
"0000159772","1.0","0000001158","PSYCH","This course prepares students with tools for understanding how research studies in psychology are conceptualized, designed, and ethically conducted, and how data is analyzed, interpreted, and disseminated. Students apply this understanding in independent and small group research projects. In the process, students develop critical reading, thinking, and scientific writing skills. Students attend lectures plus one two-hour laboratory per week. Offered each semester. Also counts toward environmental studies major and statistics and data science and public health studies concentrations. Prerequisites: PSYCH 125, and STAT 110 or STAT 172 or ECON 260.","18","","NTS;OEP","0000001158","A","","Daniel R. Nelson","","S","200","18","Research Methods","Students in Psych 230A must also register for Psych 230 AL.","230","{'day': 'Mo', 'end': '10:00', 'location': 'RNS 124', 'start': '09:05'};{'day': 'We', 'end': '10:00', 'location': 'RNS 124', 'start': '09:05'};{'day': 'Fr', 'end': '10:00', 'location': 'RNS 124', 'start': '09:05'}","False","Prerequisites: PSYCH 125, and STAT 110 or STAT 172 or ECON 260.","A","3","","","C","20243","Research Methods in Psychology","Research","2024"
"0000159773","0.0","0000026692","PSYCH","","18","","","0000001158","A","","Daniel R. Nelson","","S","200","18","Research Methods Lab","","230","{'day': 'We', 'end': '12:45', 'location': 'RNS 160C', 'start': '10:45'}","False","False","A","3","","","C","20243","","Lab","2024"
"0000159774","1.0","0000000535","QUEST","In this course, students consider the modern age in light of their Enduring Questions experience. Topics include artists and authors from the twentieth century to the present, such as Freud, Picasso, Woolf, Arendt, and Borges, addressing topics such as the rise of nationalism, rejections of colonialism, globalization, migration, and race and racism. Students identify and evaluate their own ethical views in relation to ethical theories, like consequentialism and virtue ethics, encountered throughout the Enduring Questions program. Offered annually in the spring semester. Prerequisites: QUEST 217.","14","","CRE;ERC","","","","Hsiang-Lin Shih","","S","200","20","Critics, Dreamers, Radicals","","218","{'day': 'Mo', 'end': '12:45', 'location': 'OM 110', 'start': '11:50'};{'day': 'We', 'end': '12:45', 'location': 'OM 110', 'start': '11:50'};{'day': 'Fr', 'end': '12:45', 'location': 'OM 110', 'start': '11:50'}","False","Prerequisites: QUEST 217.","C","3","","","C","20243","","Research","2024"
"0000159784","1.0","0000040258","CHEM","Human demands place immense pressure on finite energy and material resources. This course focuses on concepts and tools employed by environmental chemists to understand the chemical processes and phenomena associated with earth's compartments, chemical fate and transport, toxicity, chemical ecology, energy resources, and life cycle assessments. Through use and discussion of the primary literature students generate a research proposal that attends to the interplay of chemical cycles and systems while considering solutions to contemporary challenges. Offered alternate years during Spring semester (next time 2025). Prerequisite: Any level II course in biology, chemistry, and physics, or a level II or level III natural science course in environmental studies.","20","0/0","","","","","Paul T. Jackson","","S","300","24","Environmental Chemistry","Not open to first-year students.","363","{'day': 'Tu', 'end': '11:00', 'location': 'RNS 435', 'start': '09:35'};{'day': 'Th', 'end': '10:50', 'location': 'RNS 435', 'start': '09:30'}","False","Any level II course in biology, chemistry, and physics, or a level II or level III natural science course in environmental studies.","","3","","","C","20243","","Research","2024"
"0000159785","1.0","0000000259","ECON","This course takes an analytical approach to economic reasoning and contemporary issues. The course introduces microeconomic and macroeconomic theories with applications to relevant topics, such as employment, growth, environmental protection, affirmative action, exchange rate fluctuations, taxes, and welfare reform. Students explore economics as an intelligent approach to understanding our daily lives as citizens, workers, managers and consumers. Offered each semester. This course does NOT count toward the economics major, but is the prerequisite for all higher-level economics courses. Also counts toward environmental studies major (social science emphasis) and business and management studies concentration.","26","","QCR;SCS","","","","Urbashi Mookerjee","","S","100","25","Principles of Econ","","121","{'day': 'Mo', 'end': '12:45', 'location': 'HH 434', 'start': '11:50'};{'day': 'We', 'end': '12:45', 'location': 'HH 434', 'start': '11:50'};{'day': 'Fr', 'end': '12:45', 'location': 'HH 434', 'start': '11:50'}","False","False","D","3","","","C","20243","Principles of Economics","Research","2024"
"0000159786","1.0","0000034978","ECON","This course emphasizes theoretical foundations, mathematical structure, and applications of major econometric techniques appropriate for cross-sectional and panel data. Topics to be covered include generalized least squares, dummy variables, non-linear models, instrumental variables techniques, fixed- and random-effects models, and limited dependent variable models. This course is recommended for students interested in analysis of issues in microeconomics and public policy. Offered annually. ECON 384 and ECON 385 may not both be used to satisfy the economic analysis requirements for either the economics or quantitative economics major. Prerequisite: ECON 262 and one of ECON 260, ECON 263, or STAT 272; or permission of instructor.","19","0/0","","","","","Kulsoom Hisam","","S","300","18","Econometrics Cross-Sec & Panel Data","Open to juniors and seniors only.;Counts toward Quantitative Research requirement for Quantitative Economics;major.","384","{'day': 'Mo', 'end': '13:50', 'location': 'HH 201', 'start': '12:55'};{'day': 'We', 'end': '13:50', 'location': 'HH 201', 'start': '12:55'};{'day': 'Fr', 'end': '13:50', 'location': 'HH 201', 'start': '12:55'}","False","ECON 262 and one of ECON 260, ECON 263, or STAT 272; or permission of instructor.","","3","","0/0","C","20243","Econometrics: Cross-Sectional and Panel Data","Research","2024"
"0000159800","1.0","0000034973","CSCI","Students explore special topics in computer science. Topics may vary from year-to-year. May be repeated if topics are different. Offered periodically. Prerequisite: permission of instructor.","24","","","","","","Will E. Leeson","","S","200","20","Top: Compilers","Topic: Compilers;Prerequisite: CSCI 251 or permission of instructor.;This course will count as a Designated elective for the Computer Science major.","200","{'day': 'Mo', 'end': '12:45', 'location': 'RNS 203', 'start': '11:50'};{'day': 'We', 'end': '12:45', 'location': 'RNS 203', 'start': '11:50'};{'day': 'Fr', 'end': '12:45', 'location': 'RNS 203', 'start': '11:50'}","False","permission of instructor.","A","3","","","C","20243","Topics in Computer Science","Topic","2024"
"0000159801","1.0","0000000295","CSCI","The software we design has real effects in people's lives. This course explores the ethical and social considerations inherent in computer-based systems, develops skills in thinking about those considerations and in collecting data to determine their effects, and expands students' abilities to integrate these issues and skills into software development procedures, largely through an extensive team analysis of a ""live"" software project. Coursework uses extended case studies and surveys topics such as professional and ethical responsibilities, risk, liability, intellectual property, privacy, and computer crime. Offered annually. Also counts toward business and management studies concentration. Prerequisite: CSCI 251 and computer science major.","21","0/0","ERC;OEP","","","","Michael Haydock","","S","200","20","Ethical Issues in Software Design","Prerequisite: Completion of CSCI 251 or permission of instructor.;Open only to SR and JR Computer Science majors.","263","{'day': 'Mo', 'end': '13:50', 'location': 'RNS 202', 'start': '12:55'};{'day': 'We', 'end': '13:50', 'location': 'RNS 202', 'start': '12:55'};{'day': 'Fr', 'end': '13:50', 'location': 'RNS 202', 'start': '12:55'}","False","CSCI 251 and computer science major.","A","3","","3/0","C","20243","","Research","2024"
"0000159803","1.0","0000000452","ENGL","In this seminar, students learn about a range of methods for literary research by exploring literature in the context of critical, theoretical, cultural, or historical materials. For each student, the centerpiece of the course is the research and writing of a long essay that represents his or her individual research interests. Students share and respond to each other's work-in-progress and present their completed projects to the seminar. May be repeated if topic is different. Prerequisites: open to juniors and seniors who have completed ENGL 185 and at least two level II English courses or by permission of the instructor.","16","","","","","","Linda Mokdad","","S","300","16","Sem: Contemporary American Cinema","","399","{'day': 'Tu', 'end': '13:10', 'location': 'OM 140', 'start': '11:45'};{'day': 'Th', 'end': '14:05', 'location': 'OM 140', 'start': '12:45'}","False","Prerequisites: open to juniors and seniors who have completed ENGL 185 and at least two level II English courses or by permission of the instructor.","A","3","","","C","20243","The Major Seminar","Seminar","2024"
"0000159804","1.0","0000033299","PSCI","Religion has played a crucial role in most major issues of American politics ranging from slavery, civil rights, prohibition, the criticism of capitalism, the affirmation of capitalism, abortion, same-sex marriage and the very place of religion in our public life. This course examines the ways in which religion and politics intersect in public opinion, campaigns, public policy, lobbying, court cases, political rhetoric, and the broader principles of American political culture. Looking at both quantitative and qualitative evidence, the course explores different theoretical explanations of the role of religion in American politics. Offered alternate years.","24","","","","","","Daniel Hofrenning","","S","200","27","Religion and American Politics","","214","{'day': 'Mo', 'end': '14:55', 'location': 'TOH 212', 'start': '14:00'};{'day': 'We', 'end': '14:55', 'location': 'TOH 212', 'start': '14:00'};{'day': 'Fr', 'end': '14:55', 'location': 'TOH 212', 'start': '14:00'}","False","False","","3","","","O","20243","","Research","2024"
"0000159810","1.0","0000000611","HIST","This survey of modern Japan from 1800 to the present examines the political transformation of the Meiji Restoration, the industrial revolution and social and cultural change, the rise and fall of party government, militarism and Japanese expansionism in World War II, the American occupation, and postwar social, political, economic, and cultural developments. Offered alternate years. Also counts toward Asian studies and Japanese majors and Asian studies and business and management studies concentrations.","26","","GHS","","","","Eric R. Becklin","","S","200","25","Modern Japan","","253","{'day': 'Mo', 'end': '12:45', 'location': 'TOH 108', 'start': '11:50'};{'day': 'We', 'end': '12:45', 'location': 'TOH 108', 'start': '11:50'};{'day': 'Fr', 'end': '12:45', 'location': 'TOH 108', 'start': '11:50'}","False","False","","3","","","C","20243","","Research","2024"
"0000159824","1.0","0000000278","ECON","Government action affects us all. We pay taxes; we use public roads, schools, and parks. Some prices we pay are lower due to government subsidies; others are higher due to taxes. Government actions influence both the efficiency of our economy and the equity and equality within our society. Students learn valuable analytical tools for evaluating public projects, tax policies, entitlement programs and voting behavior. Offered annually. Prerequisite: ECON 262 and one of ECON 260, ECON 263, or STAT 272; or permission of instructor.","19","0/0","","","","","Noah M. Braun","","S","300","18","Econ of Public Policy","Open to juniors and seniors only.;Counts toward Quantitative Research requirement for Quantitative Economics;major.","371","{'day': 'Tu', 'end': '14:45', 'location': 'HH 205', 'start': '13:20'};{'day': 'Th', 'end': '15:35', 'location': 'HH 205', 'start': '14:15'}","False","ECON 262 and one of ECON 260, ECON 263, or STAT 272; or permission of instructor.","","3","","0/0","C","20243","Economics of Public Policy","Research","2024"
"0000159825","1.0","0000000488","FREN","Students explore a particular period or century through examination of selected literary and non-literary works within their socio-historical and cultural contexts. Coursework includes discussion, analysis, and interpretation of representative works. Sample topics: ""19th-Century French Literature,"" ""La Belle Epoque,"" and ""20th-Century French Literature."" May be repeated if period is different. Taught in French. Offered at least alternate years. Prerequisite: minimum of one 250-level course (two recommended).","9","","","","","","Madeleine D. Wolf","","S","200","20","Top: 19th Century Literature","","273","{'day': 'Tu', 'end': '11:00', 'location': 'TOH 300', 'start': '09:35'};{'day': 'Th', 'end': '10:50', 'location': 'TOH 300', 'start': '09:30'}","False","minimum of one 250-level course (two recommended).","","3","","","O","20243","Period Studies","Topic","2024"
"0000159841","1.0","0000036257","WRIT","Writing and Rhetoric courses, taught by faculty across the college, engage students in writing for multiple purposes and audiences. Each course explores a contemporary question of interest to college students. Students write in multiple genres and engage in writing as a systematic process with opportunities to respond to feedback. They learn, evaluate, and use appropriate technologies to explore, discuss, and write about course content. This course is limited to first-year students and sophomores.","19","","WRR","0000036257","K","","Peter Moench","0/0","S","100","18","Top: Who Needs Heroes?","Section topic: Who Needs Heroes?","120","{'day': 'Tu', 'end': '13:10', 'location': 'TOH 110', 'start': '11:45'};{'day': 'Th', 'end': '14:05', 'location': 'TOH 110', 'start': '12:45'}","False","False","K","3","0/0","","C","20243","Writing and Rhetoric","Topic","2024"
"0000159943","0.25","0000017526","HIST","","8","","","","","","Eric R. Becklin","","S","200","10","LAC - Chinese","Meeting time will be decided based on availability of the registered students.;Prerequisite: Completion of Chinese 231 or equivalent experience. This course;cannot be wish listed. Add it after registering for HIST 251 (main course).","251","","False","Completion of Chinese 231 or equivalent experience. This course","","3","","","O","20243","","FLAC","2024"
"0000159944","0.25","0000036031","PSCI","","6","","","","","","Kristina Medina-Vilariño","","S","200","10","LAC - Spanish","Meeting times will be decided based on availability of the registered students.;Prerequisite: Completion of Spanish 232 or equivalent experience. This course;cannot be wish listed. Add it after registering for PSCI 257 (main course).","257","","False","Completion of Spanish 232 or equivalent experience. This course","","3","","","O","20243","","FLAC","2024"
"0000159945","1.0","0000000857","MUSIC","Students encounter in-depth studies in a specific topic or area of musicology. The content and nature of this course are determined by the instructor and the music department. Sample topics include American music, South Asian music, Opera, and Music, Gender, and Sexuality. May be repeated if topic is different. Offered each semester. Prerequisite: MUSIC 141 or permission of instructor.","19","","","","","","Cole D. Swanson","","S","300","18","Top: Film Music and Sound","","345","{'day': 'Tu', 'end': '09:25', 'location': 'CHM 239', 'start': '08:00'};{'day': 'Th', 'end': '09:20', 'location': 'CHM 239', 'start': '08:00'}","False","MUSIC 141 or permission of instructor.","A","3","","","C","20243","Advanced Study in Musicology","Topic","2024"
"0000159946","1.0","0000000857","MUSIC","Students encounter in-depth studies in a specific topic or area of musicology. The content and nature of this course are determined by the instructor and the music department. Sample topics include American music, South Asian music, Opera, and Music, Gender, and Sexuality. May be repeated if topic is different. Offered each semester. Prerequisite: MUSIC 141 or permission of instructor.","17","","","","","","Siriana B. Lundgren","","S","300","18","Top: Music & Power in the Amer West","Full topic title: Music and Power in the American West","345","{'day': 'Tu', 'end': '11:00', 'location': 'CHM 239', 'start': '09:35'};{'day': 'Th', 'end': '10:50', 'location': 'CHM 239', 'start': '09:30'}","False","MUSIC 141 or permission of instructor.","B","3","","","O","20243","Advanced Study in Musicology","Topic","2024"
"0000159975","0.25","0000040329","MUSIC","","2","","","","","","David R. Castro","","S","200","10","LAC - Spanish","Meeting time will be decided based on availability of the registered students.;Prerequisite: Completion of Spanish 232 or equivalent experience. This course;cannot be wish listed. Add it after registering for MUSIC 214 (main course).","214","","False","Completion of Spanish 232 or equivalent experience. This course","","3","","","O","20243","","FLAC","2024"
