"clbid","credits","crsid","department","description","enrolled","firstyear","gereqs","groupid","grouptype","halfcredit","instructors","junior","learningmode","level","max","name","notes","number","offerings","pn","prerequisites","section","semester","senior","sophomore","status","term","title","type","year"
"0000165242","1.0","0000036173","FYS","This course emphasizes critical thinking, conversation, collaboration, and academic habits for the liberal arts. Students learn key skills like locating and evaluating academic sources, as well as reading, reflecting, and responding to texts. Students cultivate their own curiosity while also learning how to engage in community, better understanding their responsibilities to each other. This course is open to first-year students and a limited number of sophomores. Prerequisite: first-year student status.","0","","FYS","0000036173","C","","Brianna R. Johnson","0/0","S","100","18","Top: First-Year Seminar","","120","{'day': 'Mo', 'end': '10:00', 'location': 'TBA', 'start': '09:05'};{'day': 'We', 'end': '10:00', 'location': 'TBA', 'start': '09:05'};{'day': 'Fr', 'end': '10:00', 'location': 'TBA', 'start': '09:05'}","False","first-year student status.","C","3","0/0","","O","20253","First-Year Seminar","Topic","2025"
"0000165244","1.0","0000037534","RAMAT","Race Matters is an interdisciplinary learning community for first-year students that focuses on race, ethnicity, and related matters (such as gender, sexuality, class, and religion) in the twenty-first century with a general though not exclusive focus on the United States. The thoroughly integrated curriculum of these three courses bridges the humanities and the social sciences, offering students a deep and broad engagement with race and ethnicity in the contemporary world. This course is the third course in the three-course Race Matters Sequence. It is only open to Race Matters students. RAMAT 130 is offered annually in the spring semester. Prerequisite: RAMAT 110 and SOAN 121.","0","","WRR","0000037534","","","Dana R. Horton","0/0","S","100","20","Top: Race Matters - Writing and Rhe","Open to Race Matters students only.","130","{'day': 'Tu', 'end': '13:10', 'location': 'TBA', 'start': '11:45'};{'day': 'Th', 'end': '14:05', 'location': 'TBA', 'start': '12:45'}","False","RAMAT 110 and SOAN 121.","","3","0/0","0/0","O","20253","Race Matters","Research","2025"
"0000165248","1.0","0000020072","WRIT","Blending the reading seminar and writing workshop, this course offers advanced practice in critical reading and writing with emphasis on a particular discipline or topic. Students will read and respond critically to a range of writing that may include textbook chapters, popular feature stories, and creative literature. The course emphasizes how writers make and support claims, integrate research, and narrate to communicate effectively in a variety of genres for multiple audiences. Click on course title in the class and lab for more information about the course for that term. Prerequisite: successful completion of Writing and Rhetoric.","0","","WRI;WAC","","","","Ryan C. Eichberger","","S","200","15","Top: Sci in World & Word","Prerequisite: completion of WRR.;This course includes an academic civic engagement (ACE) component.","211","{'day': 'Mo', 'end': '13:50', 'location': 'RML 421', 'start': '12:55'};{'day': 'We', 'end': '13:50', 'location': 'RML 421', 'start': '12:55'};{'day': 'Fr', 'end': '13:50', 'location': 'RML 421', 'start': '12:55'}","False","successful completion of Writing and Rhetoric.","","3","","","O","20253","Topics in Writing","Topic","2025"
"0000165252","1.0","0000021529","MEST","This course introduces students to different topics within the cultures and traditions of the modern Middle East. Students gain familiarity with significant moments, movements, voices, and trends in society, politics, architecture, and literature, and their interdependence. The course also acquaints students with intellectual debates and conflicts in and about the Middle East, and enables them to better think through those debates for themselves. May be repeated if topic is different. Offered annually in the spring semester.","0","","MCG;WRI;GHS;WAC","","","","Ibtesam Al Atiyat","","S","200","19","Top: Sociology of Arabic Lit","","202","{'day': 'Tu', 'end': '11:00', 'location': 'OM 305', 'start': '09:35'};{'day': 'Th', 'end': '10:50', 'location': 'OM 305', 'start': '09:30'}","False","False","","3","","","O","20253","Topics in Modern Middle Eastern Studies","Topic","2025"
"0000165253","1.0","0000021530","JAPAN","In this fourth-year-level Japanese course, students explore a specified topic or theme in language, in various text/media (literature, newspaper, manga, and films), in culture/civilization, or in a combination of these, through close examination of texts (written or visual), discussion, analysis, and interpretation of selected materials. Sample topics include"" Best Sellers and Film Adaptations"" and ""Haiku and the Concept of Nature."" May be repeated if topic is different. Taught in Japanese. Also counts toward Asian studies major and concentration. Prerequisite: JAPAN 302 or equivalent.","0","","FOL-J","","","","Hiroe Akimoto","","S","300","24","Top: Special Topics/Japanese","","320","{'day': 'Mo', 'end': '13:50', 'location': 'TOH 114', 'start': '12:55'};{'day': 'We', 'end': '13:50', 'location': 'TOH 114', 'start': '12:55'};{'day': 'Fr', 'end': '13:50', 'location': 'TOH 114', 'start': '12:55'}","False","JAPAN 302 or equivalent.","","3","","","O","20253","Special Topics in Japanese","Topic","2025"
"0000165257","0.5","0000024291","EDUC","Students are assigned to a full-time internship in schools under the guidance of a competent cooperating teacher and supervised by faculty from both the content area department and the Education Department. Minimum of 6-12 full-time weeks teaching. Only student teachers may enroll: seniors or college graduates seeking an additional license. Offered each semester and during January Term. Cannot be taken concurrently with EDUC 389. Prerequisite: completion of EDUC 389 or equivalent.","0","0/0","","","","","Nancy Veverka","0/0","S","300","2","Top: Student Teaching: Additional L","Open to seniors in the professional semester only.;M-F 7:30-4:00","391","","False","completion of EDUC 389 or equivalent.","A","3","","0/0","O","20253","Student Teaching: Additional License","Topic","2025"
"0000165258","1.0","0000017673","ARTS","The department periodically offers special topics courses. The specific title of the course is listed in the class and lab schedule when it is offered.","0","","","","","","Courtney M. Leonard","","S","200","15","Top: The Art of Water","Topic: The Art of Water: Mapping, Memory, and Materiality;The materials fee for ART 240 will be $150.","240","{'day': 'Tu', 'end': '11:00', 'location': 'TBA', 'start': '08:00'};{'day': 'Th', 'end': '10:50', 'location': 'TBA', 'start': '08:00'}","False","False","A","3","","","O","20253","Topics in the Fine Arts","Topic","2025"
"0000165259","1.0","0000036173","FYS","This course emphasizes critical thinking, conversation, collaboration, and academic habits for the liberal arts. Students learn key skills like locating and evaluating academic sources, as well as reading, reflecting, and responding to texts. Students cultivate their own curiosity while also learning how to engage in community, better understanding their responsibilities to each other. This course is open to first-year students and a limited number of sophomores. Prerequisite: first-year student status.","0","","FYS","0000036173","G","","Katherine S. Tegtmeyer Pak","0/0","S","100","18","Top: First-Year Seminar","","120","{'day': 'Tu', 'end': '09:25', 'location': 'TBA', 'start': '08:00'};{'day': 'Th', 'end': '09:20', 'location': 'TBA', 'start': '08:00'}","False","first-year student status.","H","3","0/0","","O","20253","First-Year Seminar","Topic","2025"
"0000165260","1.0","0000036173","FYS","This course emphasizes critical thinking, conversation, collaboration, and academic habits for the liberal arts. Students learn key skills like locating and evaluating academic sources, as well as reading, reflecting, and responding to texts. Students cultivate their own curiosity while also learning how to engage in community, better understanding their responsibilities to each other. This course is open to first-year students and a limited number of sophomores. Prerequisite: first-year student status.","0","","FYS","0000036173","K","","Heather Campbell","0/0","S","100","18","Top: First-Year Seminar","","120","{'day': 'Tu', 'end': '14:45', 'location': 'TBA', 'start': '13:20'};{'day': 'Th', 'end': '15:35', 'location': 'TBA', 'start': '14:15'}","False","first-year student status.","K","3","0/0","","O","20253","First-Year Seminar","Topic","2025"
"0000165261","1.0","0000036257","WRIT","Writing and Rhetoric courses, taught by faculty across the college, engage students in writing for multiple purposes and audiences. Each course explores a contemporary question of interest to college students. Students write in multiple genres and engage in writing as a systematic process with opportunities to respond to feedback. They learn, evaluate, and use appropriate technologies to explore, discuss, and write about course content. This course is limited to first-year students and sophomores.","0","","WRR","0000036257","L","","Nissa Parmar","0/0","S","100","18","Top: Writing and Rhetoric","","120","{'day': 'Tu', 'end': '13:10', 'location': 'RML 421', 'start': '11:45'};{'day': 'Th', 'end': '14:05', 'location': 'RML 421', 'start': '12:45'}","False","False","L","3","0/0","","O","20253","Writing and Rhetoric","Topic","2025"
"0000165263","1.0","0000021527","ENGL","These courses trace the process of literary change during a selected period of approximately one hundred years, providing an experience of chronological breadth and textual variety. Students examine the development of styles, conventions, and forms within a particular national literature or across two or more national literatures. Examples of possible topics include Declarations of Independence in American Literature; Literature of the Atlantic Triangle, 1650-1800; 20th-century British and Irish Modernism. May be repeated if topic is different. Offered periodically. Prerequisite: WRIT 120 or equivalent.","0","","ALS-L;WRI;WAC","","","","Nancy Simpson-Younger","","S","200","18","Top: The Queer Renaissance","","220","{'day': 'Mo', 'end': '10:00', 'location': 'RML 420', 'start': '09:05'};{'day': 'We', 'end': '10:00', 'location': 'RML 420', 'start': '09:05'};{'day': 'Fr', 'end': '10:00', 'location': 'RML 420', 'start': '09:05'}","False","WRIT 120 or equivalent.","A","3","","","O","20253","Topics in Literary History","Topic","2025"
"0000165264","1.0","0000000572","HIST","Selected topics in historical studies, depending on instructor. Offered periodically.","0","","HWC;GHS","","","","Patrick Wilz","","S","100","25","Top: The 1960s: Hist/Mem/Legacy","","188","{'day': 'Tu', 'end': '13:10', 'location': 'OM 305', 'start': '11:45'};{'day': 'Th', 'end': '14:05', 'location': 'OM 305', 'start': '12:45'}","False","False","","3","","","O","20253","Topical Seminar","Topic","2025"
"0000165267","1.0","0000038370","CLASS","This course combines close study of ancient texts (in English translation) with wide-ranging discussions of literary, historical, and cultural questions. Students have the opportunity to read selections from one or more genres of Greek and/or Latin literature while exploring a topic chosen by the instructor. Analytical writing assignments lead to a deeper understanding of the creative process and encourage thoughtful reflection on the re-creating and repurposing of the original texts by later authors and artists. Offered annually. Counts as an elective and satisfies WIM for Classics, Greek, Latin, and ancient studies majors. Prerequisite: WAC (any course satisfying Writing Across the Curriculum) or permission of instructor.","0","","ALS-L;WRI;CRE","","","","Anne Groton","","S","300","20","Topics in Classical Studies","","370","{'day': 'Tu', 'end': '14:45', 'location': 'TBA', 'start': '13:20'};{'day': 'Th', 'end': '15:35', 'location': 'TBA', 'start': '14:15'}","False","WAC (any course satisfying Writing Across the Curriculum) or permission of instructor.","","3","","","O","20253","","Research","2025"
"0000165268","1.0","0000001345","SPAN","Students explore one or more periods, genres, or topics of Spanish literature from its beginnings to the 21st century. Selected literary works are analyzed within their socio-historical and cultural contexts and in reference to pertinent critical or theoretical issues. Sample topics include: Sin and the Church in Medieval Literature, The Stage as Political Propaganda in Imperial Spain, and Federico García Lorca: Voices of the Oppressed. May be repeated if topic is different. Taught in Spanish. Offered annually. Prerequisite: SPAN 275.","0","","ALS-L","","","","Jonathan P. O'Conner","","S","300","17","Top: Don Quijote","Prerequisite: Completion of SPAN 275","313","{'day': 'Tu', 'end': '13:10', 'location': 'TOH 300', 'start': '11:45'};{'day': 'Th', 'end': '14:05', 'location': 'TOH 300', 'start': '12:45'}","False","SPAN 275.","","3","","","O","20253","Literature and Society in Spain","Topic","2025"
"0000165269","1.0","0000036173","FYS","This course emphasizes critical thinking, conversation, collaboration, and academic habits for the liberal arts. Students learn key skills like locating and evaluating academic sources, as well as reading, reflecting, and responding to texts. Students cultivate their own curiosity while also learning how to engage in community, better understanding their responsibilities to each other. This course is open to first-year students and a limited number of sophomores. Prerequisite: first-year student status.","0","","FYS","0000036173","D","","Emily A. Bowman","0/0","S","100","18","Top: First-Year Seminar","","120","{'day': 'Mo', 'end': '11:40', 'location': 'TBA', 'start': '10:45'};{'day': 'We', 'end': '11:40', 'location': 'TBA', 'start': '10:45'};{'day': 'Fr', 'end': '11:40', 'location': 'TBA', 'start': '10:45'}","False","first-year student status.","D","3","0/0","","O","20253","First-Year Seminar","Topic","2025"
"0000165270","1.0","0000036173","FYS","This course emphasizes critical thinking, conversation, collaboration, and academic habits for the liberal arts. Students learn key skills like locating and evaluating academic sources, as well as reading, reflecting, and responding to texts. Students cultivate their own curiosity while also learning how to engage in community, better understanding their responsibilities to each other. This course is open to first-year students and a limited number of sophomores. Prerequisite: first-year student status.","0","","FYS","0000036173","E","","Marc David","0/0","S","100","18","Top: First-Year Seminar","","120","{'day': 'Mo', 'end': '13:50', 'location': 'TBA', 'start': '12:55'};{'day': 'We', 'end': '13:50', 'location': 'TBA', 'start': '12:55'};{'day': 'Fr', 'end': '13:50', 'location': 'TBA', 'start': '12:55'}","False","first-year student status.","F","3","0/0","","O","20253","First-Year Seminar","Topic","2025"
"0000165271","1.0","0000036257","WRIT","Writing and Rhetoric courses, taught by faculty across the college, engage students in writing for multiple purposes and audiences. Each course explores a contemporary question of interest to college students. Students write in multiple genres and engage in writing as a systematic process with opportunities to respond to feedback. They learn, evaluate, and use appropriate technologies to explore, discuss, and write about course content. This course is limited to first-year students and sophomores.","0","","WRR","0000036257","K","","Amanda Randall","0/0","S","100","18","Top: Writing and Rhetoric","","120","{'day': 'Tu', 'end': '13:10', 'location': 'TOH 110', 'start': '11:45'};{'day': 'Th', 'end': '14:05', 'location': 'TOH 110', 'start': '12:45'}","False","False","K","3","0/0","","O","20253","Writing and Rhetoric","Topic","2025"
"0000165272","1.0","0000036257","WRIT","Writing and Rhetoric courses, taught by faculty across the college, engage students in writing for multiple purposes and audiences. Each course explores a contemporary question of interest to college students. Students write in multiple genres and engage in writing as a systematic process with opportunities to respond to feedback. They learn, evaluate, and use appropriate technologies to explore, discuss, and write about course content. This course is limited to first-year students and sophomores.","0","","WRR","0000036257","N","","Cole Bucciaglia","0/0","S","100","18","Top: Writing and Rhetoric","","120","{'day': 'Tu', 'end': '14:45', 'location': 'RML 421', 'start': '13:20'};{'day': 'Th', 'end': '15:35', 'location': 'RML 421', 'start': '14:15'}","False","False","N","3","0/0","","O","20253","Writing and Rhetoric","Topic","2025"
"0000165273","1.0","0000036257","WRIT","Writing and Rhetoric courses, taught by faculty across the college, engage students in writing for multiple purposes and audiences. Each course explores a contemporary question of interest to college students. Students write in multiple genres and engage in writing as a systematic process with opportunities to respond to feedback. They learn, evaluate, and use appropriate technologies to explore, discuss, and write about course content. This course is limited to first-year students and sophomores.","0","","WRR","0000036257","G","","Colin Wells","0/0","S","100","18","Top: Writing and Rhetoric","","120","{'day': 'Mo', 'end': '14:55', 'location': 'TBA', 'start': '14:00'};{'day': 'We', 'end': '14:55', 'location': 'TBA', 'start': '14:00'};{'day': 'Fr', 'end': '14:55', 'location': 'TBA', 'start': '14:00'}","False","False","G","3","0/0","","O","20253","Writing and Rhetoric","Topic","2025"
"0000165276","0.25","0000030305","DANCE","Students learn special topics in dance in a movement intensive environment. Students study the historical, social, and cultural context in which the dance topic emerged and currently functions and the physical and expressive capacities that distinguish it from other forms. Dance topics could include somatics, Gaga, contact improvisation, yoga, partnering, or aerial dance. Topics may vary from year to year. May be repeated. P/N only. Offered each semester. No prerequisite.","0","","SPM;ACB","","","","Staff","","S","100","25","Top: Topics: Intermed West African","","141","{'day': 'Mo', 'end': '12:40', 'location': 'CAD Studio 1', 'start': '11:45'};{'day': 'We', 'end': '12:40', 'location': 'CAD Studio 1', 'start': '11:45'};{'day': 'Fr', 'end': '12:40', 'location': 'CAD Studio 1', 'start': '11:45'}","True","False","A","3","","","O","20253","Topics in Movement Studies in Dance","Topic","2025"
"0000165277","0.25","0000030310","KINES","Students learn and practice the skills and techniques involved in completing a triathlon. Before enrolling, students should be able to swim at least 100 yards, cycle for at least 3 miles, and run at least 1 mile without stopping to rest. Students must provide their own equipment, including a bicycle. Offered annually in the spring semester.","0","","SPM;ACB","","","","Bob Hauck","","S","100","18","Triathlon Training","","110","{'day': 'Mo', 'end': '10:00', 'location': 'Tostrud Ctr', 'start': '09:05'};{'day': 'We', 'end': '10:00', 'location': 'Tostrud Ctr', 'start': '09:05'}","False","False","","3","","","O","20253","","Research","2025"
"0000165283","0.0","0000000309","EDUC","Students examine issues related to chemical use/abuse in our society. The course, required of all candidates for a teaching license, enhances problem identification and helping skills in students' professional and personal lives. Students develop an understanding of enabling and intervening behaviors and gain knowledge about the role of schools in addressing these and other chemical abuse concerns. P/N only. Offered each semester, evenings.","0","0/0","","","","1","Anne Breckbill","","S","200","30","Understanding Substance Abuse","Closed to First-Year Students.;For intended education licensure students only.;Meets in the first half of the semester.","231","{'day': 'Mo', 'end': '21:00', 'location': 'TOH 210', 'start': '19:00'}","True","False","","3","","","O","20253","","Research","2025"
"0000165284","1.0","0000031158","SOAN","Urban sociology investigates the complex interactions of human beings in cities and beyond. Topics include the changing relationship between people and place; social stratification along the lines of race/ethnicity, gender/sexuality, and class; and urbanism's importance in global political power and economics. Chicago will serve as an important case study for considering these social, political, and economic dynamics. Offered annually.","0","0/0","HBS;MCD;PAR;SCS","","","","David C. Schalliol","","S","200","23","Urban Sociology","","269","{'day': 'Mo', 'end': '08:55', 'location': 'TBA', 'start': '08:00'};{'day': 'We', 'end': '08:55', 'location': 'TBA', 'start': '08:00'};{'day': 'Fr', 'end': '08:55', 'location': 'TBA', 'start': '08:00'}","False","False","","3","","","O","20253","","Research","2025"
"0000165289","1.0","0000000124","BIO","Students focus on the natural history of Upper Midwest vertebrates and phylogenetic, morphological, and functional relationships of these animals. Laboratories include identification, and morphology. During field trips, students document bird migrations, amphibian chorusing, and other animal activities. Independent projects explore topics ranging from blue bird nesting behavior to thermal conductivity and insulation in animals. Students attend lectures plus one three-hour laboratory per week. Offered annually. Counts as ""comparative organismal biology"" core category. Prerequisites: BIO 150.","0","","SED","0000000124","","","Steven Freedberg","","S","200","36","Vertebrate Biology","Students enrolling in BIO 242 must enroll for BIO 242 Lab AL or BL.","242","{'day': 'Tu', 'end': '09:25', 'location': 'RNS 410', 'start': '08:00'};{'day': 'Th', 'end': '09:20', 'location': 'RNS 410', 'start': '08:00'}","False","Prerequisites: BIO 150.","","3","","","O","20253","","Research","2025"
"0000165290","0.0","0000000125","BIO","","0","","","0000000124","","","Steven Freedberg","","S","200","18","Vertebrate Biology Lab","","242","{'day': 'Tu', 'end': '16:20', 'location': 'RNS 250', 'start': '13:20'}","False","False","A","3","","","O","20253","","Lab","2025"
"0000165291","0.0","0000000125","BIO","","0","","","0000000124","","","Steven Freedberg","","S","200","18","Vertebrate Biology Lab","","242","{'day': 'Th', 'end': '15:45', 'location': 'RNS 250', 'start': '12:45'}","False","False","B","3","","","O","20253","","Lab","2025"
"0000165292","0.0","0000033667","DANCE","Veselica International Dance Ensemble introduces student performers and audiences to dance as a global art, expanding their awareness of the spectrum of dance forms and contexts in the world. Student performers develop skills by performing a variety of dance forms and experience the process of working together in an ensemble to create quality performances. Interested students can choreograph or stage international dance works, and members of the ensemble may also work with guest choreographers. The ensemble is open by audition to all students. P/N only. May be repeated.","0","","","","","","Staff","","S","100","15","Veselica Int'l Dance Ensemble","","170","","True","False","","3","","","O","20253","Veselica International Dance Ensemble","Research","2025"
"0000165312","0.25","0000031180","MUSIC","This course focuses on applying the foundations of vocal production learned in MUSIC 291 - Vocal Development and Pedagogy to the practice of teaching voice in a solo setting. Students in this course take on a private voice student for the semester and develop a systematic, personalized curriculum for this student. Topics include developing a pedagogical approach to warm-ups and vocalizations, choosing repertoire, vocal registration, vocal acoustics and format training, training different voice types, musical theater belting technique, and the aging voice. Required for BM vocal music education and BM vocal performance majors. Offered annually in spring semester. Prerequisite: MUSIC 291.","0","0/0","","","","","Tracey M. Engleman","0/15","S","200","18","Vocal Pedagogy II","This course has class-year limits and it is open only to juniors and a limited;number of seniors.","292","{'day': 'Mo', 'end': '11:40', 'location': 'CHM 233', 'start': '10:45'};{'day': 'We', 'end': '11:40', 'location': 'CHM 233', 'start': '10:45'}","False","MUSIC 291.","","3","0/5","0/0","O","20253","","Research","2025"
"0000165338","1.0","0000000533","QUEST","Christian and Muslim empires rose and fell in the Medieval and Renaissance Mediterranean world. The end of feudalism and changing social structures offered platforms to marginalized speakers. This course usually includes the Quran, Christian and Muslim theology, mysticism, and authors like Augustine, Hildegard von Bingen, Dante, Machiavelli, and Michelangelo. Course themes include journeys, gender, sexuality, faith, and reason. Students reflect on the relevance of premodern Europe to today's world and their learning process thus far. Counts toward medieval studies major. Prerequisites: QUEST 113 and QUEST 115.","0","","FYW;HWC;WRR","0000000533","A","","Ibtesam Al Atiyat","0/0","S","100","22","Warriors, Mystics, Reformers","Open to Enduring Questions students only.","116","{'day': 'Mo', 'end': '13:50', 'location': 'OM 140', 'start': '12:55'};{'day': 'We', 'end': '13:50', 'location': 'OM 140', 'start': '12:55'};{'day': 'Fr', 'end': '13:50', 'location': 'OM 140', 'start': '12:55'}","False","Prerequisites: QUEST 113 and QUEST 115.","A","3","0/0","0/0","O","20253","","Research","2025"
