"clbid","credits","crsid","department","description","enrolled","firstyear","gereqs","groupid","grouptype","halfcredit","instructors","junior","learningmode","level","max","name","notes","number","offerings","pn","prerequisites","section","semester","senior","sophomore","status","term","title","type","year"
"0000164511","1.0","0000000516","GERM","Students examine current issues in German-speaking societies such as politics, sustainability, social welfare, diversity, and migration. They compare multiple perspectives on, and connections between the issues through sources including documentaries, podcasts, and news articles. Short writing assignments and oral presentations emphasize analysis of texts' strategic organization, argumentative structure, style, and layered voices. Advanced grammar review supports analytical tasks. Taught in German. A weekly small group discussion section led by a native German speaker is required. Offered annually in the spring semester. Prerequisite: GERM 232 or by placement test.","0","","FOL-G;ORC;WLC","0000144704","","","Yann Chen","","S","200","20","German-speaking Societies","Prerequisite: GERM 232 or by placement test;Students in GERM 252 must also register for GERM 252 discussion.","252","{'day': 'Tu', 'end': '13:10', 'location': 'TOH 308', 'start': '11:45'};{'day': 'Th', 'end': '14:05', 'location': 'TOH 308', 'start': '12:45'}","False","GERM 232 or by placement test.","","3","","","O","20253","German-speaking Societies in Global Context","Research","2025"
"0000164519","0.25","0000037325","ID","This .25 credit online course supports the curriculum of Smith Center study abroad and away programs with readings and reflection assignments for the Ole Experience in Practice requirement. Students reflect on their experiences in their study abroad or away location, discuss global systems that connect learning, and also engage in discussions of identity across borders. Course topics include identity, vocation, globalization, intercultural communication, adjusting to a new environment, defining culture, and understanding through intercultural practices. Offered fall and spring semesters.","0","","OEP","","","","Bridget A. Draxler;Theresa A. Heath","","S","200","15","Global Engagement Seminar","Prerequisite: concurrent registration in a study abroad/away semester or;year-long program.","296","","True","concurrent registration in a study abroad/away semester or","A","3","","","O","20253","","Research","2025"
"0000164520","0.25","0000037325","ID","This .25 credit online course supports the curriculum of Smith Center study abroad and away programs with readings and reflection assignments for the Ole Experience in Practice requirement. Students reflect on their experiences in their study abroad or away location, discuss global systems that connect learning, and also engage in discussions of identity across borders. Course topics include identity, vocation, globalization, intercultural communication, adjusting to a new environment, defining culture, and understanding through intercultural practices. Offered fall and spring semesters.","0","","OEP","","","","Theresa A. Heath","","S","200","15","Global Engagement Seminar","Prerequisite: Completion of a Smith Center study abroad/away program and not yet;fulfilled OEP requirement.","296","","True","Completion of a Smith Center study abroad/away program and not yet","B","3","","","O","20253","","Research","2025"
"0000164528","1.0","0000000291","CSCI","This course explores computer hardware and how the code we write uses it, taught through in-class labs and daily assignments. Topics include an introduction to computer systems, computer organization and architecture, the component-level design of computer hardware, forms of parallelism, machine-level implementation of programming language features, memory organization, logic circuits, data representation, assembly programming, and a brief introduction to networking and cloud computing. Offered each semester. Prerequisite: CSCI 221 or permission of instructor.","0","","","","","","Melissa K. Lynn","0/4","S","200","22","Hardware Design","Prerequisite: CSCI 221.;Course fee of $105 required.;This course is open to a limited number of seniors and juniors.","241","{'day': 'Mo', 'end': '11:40', 'location': 'RNS 202', 'start': '10:45'};{'day': 'We', 'end': '11:40', 'location': 'RNS 202', 'start': '10:45'};{'day': 'Fr', 'end': '11:40', 'location': 'RNS 202', 'start': '10:45'}","False","CSCI 221 or permission of instructor.","A","3","0/2","","O","20253","","Research","2025"
"0000164529","1.0","0000000291","CSCI","This course explores computer hardware and how the code we write uses it, taught through in-class labs and daily assignments. Topics include an introduction to computer systems, computer organization and architecture, the component-level design of computer hardware, forms of parallelism, machine-level implementation of programming language features, memory organization, logic circuits, data representation, assembly programming, and a brief introduction to networking and cloud computing. Offered each semester. Prerequisite: CSCI 221 or permission of instructor.","0","","","","","","Sravya Kondrakunta","0/4","S","200","22","Hardware Design","Prerequisite: CSCI 221.;Course fee of $105 required.;This course is open to a limited number of seniors and juniors.","241","{'day': 'Tu', 'end': '09:25', 'location': 'TBA', 'start': '08:00'};{'day': 'Th', 'end': '09:20', 'location': 'TBA', 'start': '08:00'}","False","CSCI 221 or permission of instructor.","B","3","0/2","","O","20253","","Research","2025"
"0000164535","1.0","0000001392","THEAT","Examines theatrical activities in the period 1700 to the present, from three interrelated perspectives: 1) theater as social history; 2) theater as dramatic literature; and 3) theater as performance (the result of creative decisions made by playwrights, actors, directors, and designers). Offered in the spring semester. Also counts toward musical theater concentration. Prerequisite: THEAT 110 or THEAT 180 or permission of instructor.","0","","ALS-L;HWC;GHS;PAR","","","","Sara Pillatzki-Warzeha","","S","200","18","Hist Theat-Since 1700","","271","{'day': 'Tu', 'end': '14:45', 'location': 'TB 227', 'start': '13:20'};{'day': 'Th', 'end': '15:35', 'location': 'TB 227', 'start': '14:15'}","False","THEAT 110 or THEAT 180 or permission of instructor.","","3","","","O","20253","History of Theater since 1700","Research","2025"
"0000164540","1.0","0000029265","NURS","This course focuses on holistic health assessment, health promotion, and disease prevention across the lifespan. Students obtain health histories, identify risk factors, and develop health assessment skills in physiologic, psychosocial, developmental, and spiritual dimensions. Identification of data from a holistic perspective and analysis of findings through critical thinking are emphasized. Active learning experiences are utilized to apply knowledge and informatics during health assessment. Students attend lectures plus one two-hour laboratory per week. Offered annually in the spring semester. Prerequisites: open to sophomore nursing majors only; concurrent enrollment in NURS 212.","0","0/0","","0000029265","","","Susan Huehn","0/0","S","200","40","Holistic Health","Open to Sophomore Nursing majors only.;Students in NURS 211 must also register for one NURS 211 lab.;Final lab assignments will be determined in January.","211","{'day': 'Mo', 'end': '14:55', 'location': 'RNS 160E', 'start': '14:00'};{'day': 'We', 'end': '14:55', 'location': 'RNS 160E', 'start': '14:00'};{'day': 'Fr', 'end': '14:55', 'location': 'RNS 160E', 'start': '14:00'}","False","Prerequisites: open to sophomore nursing majors only; concurrent enrollment in NURS 212.","","3","0/0","","O","20253","Holistic Health Assessment and Health Promotion","Research","2025"
"0000164541","0.0","0000029283","NURS","","0","0/0","","0000029265","","","Susan Huehn","0/0","S","200","8","Holistic Health Lab","","211","{'day': 'Tu', 'end': '11:30', 'location': 'RNS 160D', 'start': '09:00'}","False","False","A","3","0/0","","O","20253","","Lab","2025"
"0000164542","0.0","0000029283","NURS","","0","0/0","","0000029265","","","Susan Huehn","0/0","S","200","8","Holistic Health Lab","","211","{'day': 'Tu', 'end': '15:00', 'location': 'RNS 160D', 'start': '12:30'}","False","False","B","3","0/0","","O","20253","","Lab","2025"
"0000164543","0.0","0000029283","NURS","","0","0/0","","0000029265","","","Susan Huehn","0/0","S","200","9","Holistic Health Lab","","211","{'day': 'Th', 'end': '11:30', 'location': 'RNS 160D', 'start': '09:00'}","False","False","C","3","0/0","","O","20253","","Lab","2025"
"0000164544","0.0","0000029283","NURS","","0","0/0","","0000029265","","","Susan Huehn","0/0","S","200","8","Holistic Health Lab","","211","{'day': 'Th', 'end': '15:00', 'location': 'RNS 160D', 'start': '12:30'}","False","False","D","3","0/0","","O","20253","","Lab","2025"
"0000164545","1.0","0000000126","BIO","Students journey toward greater understanding of the human body through an integrated study of the structure of the body (anatomy) and how organs such as the brain, heart, and kidney perform their remarkable functions (physiology). The course is designed primarily for students intending careers in the health sciences. Students attend lectures plus one three-hour laboratory per week. Offered each semester. Prerequisite: BIO 143, or BIO 150 and BIO 227 or CH/BI 227.","0","","","0000000126","","","Steven Cole","","S","200","96","Human Anatomy & Physiology II","Students registering for BIO 243 must also register for BIO 243 Lab AL, BL, CL,;DL or EL.","243","{'day': 'Mo', 'end': '10:00', 'location': 'RNS 150', 'start': '09:05'};{'day': 'We', 'end': '10:00', 'location': 'RNS 150', 'start': '09:05'};{'day': 'Fr', 'end': '10:00', 'location': 'RNS 150', 'start': '09:05'}","False","BIO 143, or BIO 150 and BIO 227 or CH/BI 227.","","3","","","O","20253","Human Anatomy and Physiology: Organs and Organ Systems","Research","2025"
"0000164546","0.0","0000000127","BIO","","0","","","0000000126","","","Takashi Maie","","S","200","18","Human Anatomy & Physiology II Lab","","243","{'day': 'Mo', 'end': '15:00', 'location': 'RNS 254', 'start': '13:00'}","False","False","A","3","","","O","20253","","Lab","2025"
"0000164547","0.0","0000000127","BIO","","0","","","0000000126","","","Takashi Maie","","S","200","18","Human Anatomy & Physiology II Lab","","243","{'day': 'Tu', 'end': '11:00', 'location': 'RNS 254', 'start': '09:00'}","False","False","B","3","","","O","20253","","Lab","2025"
"0000164548","0.0","0000000127","BIO","","0","","","0000000126","","","Takashi Maie","","S","200","18","Human Anatomy & Physiology II Lab","","243","{'day': 'Tu', 'end': '13:45', 'location': 'RNS 254', 'start': '11:45'}","False","False","C","3","","","O","20253","","Lab","2025"
"0000164549","0.0","0000000127","BIO","","0","","","0000000126","","","Takashi Maie","","S","200","18","Human Anatomy & Physiology II Lab","","243","{'day': 'We', 'end': '16:00', 'location': 'RNS 254', 'start': '14:00'}","False","False","D","3","","","O","20253","","Lab","2025"
"0000164550","0.0","0000000127","BIO","","0","","","0000000126","","","Takashi Maie","","S","200","18","Human Anatomy & Physiology II Lab","","243","{'day': 'Th', 'end': '14:45', 'location': 'RNS 254', 'start': '12:45'}","False","False","E","3","","","O","20253","","Lab","2025"
"0000164551","0.0","0000000341","EDUC","All candidates must have a multicultural field experience to help develop their competence in teaching in multicultural environments. A minimum of 80 hours of field experience in a multicultural school environment (an January Term or its equivalent) is required prior to student teaching. All field experiences must be pre-approved. Below is a summary of options: EDUC 378: Multicultural Education in Hawaii; EDUC 379: Urban Education Seminar and Practicum; or pre-approved internships in multicultural schools. See Education Department faculty and website for advice and information. EDUC 382 is not a course. Rather it is a recording mechanism indicating St. Olaf students who have completed their multicultural education requirement. Students register for EDUC 382 during their professional semester. P/N only. Offered each semester.","0","0/0","","","","","Nancy Veverka","0/0","S","300","22","Human Relations","Open to seniors in the professional semester only.","382","","True","False","","3","","0/0","O","20253","","Research","2025"
"0000164568","1.0","0000037516","ENCON","Building on explorations in the Fall and January Term, this course will examine the following questions: What motivates and inspires human beings to nurture existing relationships with their environment and/or to seek a change in those relationships? What are strategies and actions for solving environmental challenges? What role will I play in Earth's future? (and in my community...). In navigating these questions, students will look through an interdisciplinary lens, engaging with a sustained research paper, creating art, and thinking about how we can take scholarship and personal explorations and translate them into civic engagement. This course is the third of a three-course Conversation Program. Prerequisites: ENCON 110 and ENCON 111.","0","","WRR","0000037516","A","","Sequoia Nagamatsu","","S","100","23","Imagineering Earth's Future","Open to Environmental Conversation program students only.","112","{'day': 'Tu', 'end': '11:00', 'location': 'RML 525', 'start': '09:35'};{'day': 'Th', 'end': '10:50', 'location': 'RML 525', 'start': '09:30'}","False","Prerequisites: ENCON 110 and ENCON 111.","A","3","","","O","20253","","Research","2025"
"0000164569","1.0","0000037516","ENCON","Building on explorations in the Fall and January Term, this course will examine the following questions: What motivates and inspires human beings to nurture existing relationships with their environment and/or to seek a change in those relationships? What are strategies and actions for solving environmental challenges? What role will I play in Earth's future? (and in my community...). In navigating these questions, students will look through an interdisciplinary lens, engaging with a sustained research paper, creating art, and thinking about how we can take scholarship and personal explorations and translate them into civic engagement. This course is the third of a three-course Conversation Program. Prerequisites: ENCON 110 and ENCON 111.","0","","WRR","0000037516","B","","Hsiang-Lin Shih","","S","100","23","Imagineering Earth's Future","Open to Environmental Conversation program students only.","112","{'day': 'Tu', 'end': '11:00', 'location': 'OM 240', 'start': '09:35'};{'day': 'Th', 'end': '10:50', 'location': 'OM 240', 'start': '09:30'}","False","Prerequisites: ENCON 110 and ENCON 111.","B","3","","","O","20253","","Research","2025"
"0000164570","0.25","0000033780","KINES","Students of all abilities will explore fitness activities and games designed to keep them healthy and active throughout their lives. Students will work at their own level and pace without pressure or competition. The course is designed to be accommodating and accessible to students with physical disabilities, but all students are welcome. Offered annually.","0","0/0","SPM;ACB","","","2","Staff","0/0","S","100","2","Inclusive Fitness","This is a second-half of semester course.;Permission of instructor required to enroll in this course.","105","{'day': 'Tu', 'end': '13:10', 'location': 'TOH 200', 'start': '11:45'};{'day': 'Th', 'end': '14:05', 'location': 'TOH 200', 'start': '12:45'}","False","False","","3","0/0","0/0","C","20253","","Research","2025"
"0000164571","1.0","0000001364","SWRK","Social work majors continue to study the methods and skills of generalist practice. They assess strengths and problems of diverse groups, organizations, and communities and use the systems perspective to help client systems frame goals and plans for social change. Students assess macrosystems and develop plans for implementing change that are reflective, scientific, just, and grounded in the liberal arts. This course includes an academic civic engagement community project. Offered annually in the spring semester. Prerequisite: SWRK 254.","0","0/0","","","","","Beth Winterfeldt","","S","200","20","Inclusive Practice: Grps/Orgs/Com","This is open only to Junior Social Work majors.","261","{'day': 'Mo', 'end': '22:00', 'location': 'TBA', 'start': '19:00'}","False","SWRK 254.","","3","0/0","0/0","O","20253","Inclusive Practice: Groups, Organizations and Communities","Research","2025"
"0000164572","0.25","0000031450","CHEM","Independent research is offered for students dedicated to an in-depth research experience. Emphasis is placed on the iterative process of experimentation and analysis. Students interested in independent research may enroll in CHEM 297 or CHEM 398. Each course requires a faculty supervisor, who will make the decision as to which course is appropriate. May be taken more than once. Pass or No Pass (P/N) only (may not be taken for a grade). Offered each term. Prerequisite: permission of the instructor.","0","","","","","","Douglas J. Beussman","","S","200","1","Independent Research (.25, .5, 1.0)","This is the 0.25 credit version of this course.","297","","True","permission of the instructor.","A","3","","","O","20253","Independent Research","Research","2025"
"0000164573","0.25","0000031450","CHEM","Independent research is offered for students dedicated to an in-depth research experience. Emphasis is placed on the iterative process of experimentation and analysis. Students interested in independent research may enroll in CHEM 297 or CHEM 398. Each course requires a faculty supervisor, who will make the decision as to which course is appropriate. May be taken more than once. Pass or No Pass (P/N) only (may not be taken for a grade). Offered each term. Prerequisite: permission of the instructor.","0","","","","","","Paul T. Jackson","","S","200","1","Independent Research (.25, .5, 1.0)","","297","","True","permission of the instructor.","B","3","","","O","20253","Independent Research","Research","2025"
"0000164574","0.25","0000031450","CHEM","Independent research is offered for students dedicated to an in-depth research experience. Emphasis is placed on the iterative process of experimentation and analysis. Students interested in independent research may enroll in CHEM 297 or CHEM 398. Each course requires a faculty supervisor, who will make the decision as to which course is appropriate. May be taken more than once. Pass or No Pass (P/N) only (may not be taken for a grade). Offered each term. Prerequisite: permission of the instructor.","0","","","","","","Anna Brezny","","S","200","1","Independent Research (.25, .5, 1.0)","","297","","True","permission of the instructor.","D","3","","","O","20253","Independent Research","Research","2025"
"0000164575","0.25","0000031450","CHEM","Independent research is offered for students dedicated to an in-depth research experience. Emphasis is placed on the iterative process of experimentation and analysis. Students interested in independent research may enroll in CHEM 297 or CHEM 398. Each course requires a faculty supervisor, who will make the decision as to which course is appropriate. May be taken more than once. Pass or No Pass (P/N) only (may not be taken for a grade). Offered each term. Prerequisite: permission of the instructor.","0","","","","","","Elodie Marlier","","S","200","1","Independent Research (.25, .5, 1.0)","","297","","True","permission of the instructor.","E","3","","","O","20253","Independent Research","Research","2025"
"0000164576","0.25","0000031450","CHEM","Independent research is offered for students dedicated to an in-depth research experience. Emphasis is placed on the iterative process of experimentation and analysis. Students interested in independent research may enroll in CHEM 297 or CHEM 398. Each course requires a faculty supervisor, who will make the decision as to which course is appropriate. May be taken more than once. Pass or No Pass (P/N) only (may not be taken for a grade). Offered each term. Prerequisite: permission of the instructor.","0","","","","","","Greg W. Muth","","S","200","1","Independent Research (.25, .5, 1.0)","","297","","True","permission of the instructor.","F","3","","","O","20253","Independent Research","Research","2025"
"0000164577","0.25","0000031450","CHEM","Independent research is offered for students dedicated to an in-depth research experience. Emphasis is placed on the iterative process of experimentation and analysis. Students interested in independent research may enroll in CHEM 297 or CHEM 398. Each course requires a faculty supervisor, who will make the decision as to which course is appropriate. May be taken more than once. Pass or No Pass (P/N) only (may not be taken for a grade). Offered each term. Prerequisite: permission of the instructor.","0","","","","","","Cassie M. Joiner","","S","200","1","Independent Research (.25, .5, 1.0)","","297","","True","permission of the instructor.","G","3","","","O","20253","Independent Research","Research","2025"
"0000164578","0.25","0000031450","CHEM","Independent research is offered for students dedicated to an in-depth research experience. Emphasis is placed on the iterative process of experimentation and analysis. Students interested in independent research may enroll in CHEM 297 or CHEM 398. Each course requires a faculty supervisor, who will make the decision as to which course is appropriate. May be taken more than once. Pass or No Pass (P/N) only (may not be taken for a grade). Offered each term. Prerequisite: permission of the instructor.","0","","","","","","Jeff J. Schwinefus","","S","200","1","Independent Research (.25, .5, 1.0)","","297","","True","permission of the instructor.","H","3","","","O","20253","Independent Research","Research","2025"
"0000164579","0.5","0000031450","CHEM","Independent research is offered for students dedicated to an in-depth research experience. Emphasis is placed on the iterative process of experimentation and analysis. Students interested in independent research may enroll in CHEM 297 or CHEM 398. Each course requires a faculty supervisor, who will make the decision as to which course is appropriate. May be taken more than once. Pass or No Pass (P/N) only (may not be taken for a grade). Offered each term. Prerequisite: permission of the instructor.","0","","","","","","Douglas J. Beussman","","S","200","1","Independent Research (.25, .5, 1.0)","","297","","True","permission of the instructor.","I","3","","","O","20253","Independent Research","Research","2025"
"0000164580","0.5","0000031450","CHEM","Independent research is offered for students dedicated to an in-depth research experience. Emphasis is placed on the iterative process of experimentation and analysis. Students interested in independent research may enroll in CHEM 297 or CHEM 398. Each course requires a faculty supervisor, who will make the decision as to which course is appropriate. May be taken more than once. Pass or No Pass (P/N) only (may not be taken for a grade). Offered each term. Prerequisite: permission of the instructor.","0","","","","","","Paul T. Jackson","","S","200","1","Independent Research (.25, .5, 1.0)","","297","","True","permission of the instructor.","J","3","","","O","20253","Independent Research","Research","2025"
"0000164581","0.5","0000031450","CHEM","Independent research is offered for students dedicated to an in-depth research experience. Emphasis is placed on the iterative process of experimentation and analysis. Students interested in independent research may enroll in CHEM 297 or CHEM 398. Each course requires a faculty supervisor, who will make the decision as to which course is appropriate. May be taken more than once. Pass or No Pass (P/N) only (may not be taken for a grade). Offered each term. Prerequisite: permission of the instructor.","0","","","","","","Anna Brezny","","S","200","1","Independent Research (.25, .5, 1.0)","","297","","True","permission of the instructor.","L","3","","","O","20253","Independent Research","Research","2025"
"0000164582","0.5","0000031450","CHEM","Independent research is offered for students dedicated to an in-depth research experience. Emphasis is placed on the iterative process of experimentation and analysis. Students interested in independent research may enroll in CHEM 297 or CHEM 398. Each course requires a faculty supervisor, who will make the decision as to which course is appropriate. May be taken more than once. Pass or No Pass (P/N) only (may not be taken for a grade). Offered each term. Prerequisite: permission of the instructor.","0","","","","","","Elodie Marlier","","S","200","1","Independent Research (.25, .5, 1.0)","","297","","True","permission of the instructor.","M","3","","","O","20253","Independent Research","Research","2025"
"0000164583","0.5","0000031450","CHEM","Independent research is offered for students dedicated to an in-depth research experience. Emphasis is placed on the iterative process of experimentation and analysis. Students interested in independent research may enroll in CHEM 297 or CHEM 398. Each course requires a faculty supervisor, who will make the decision as to which course is appropriate. May be taken more than once. Pass or No Pass (P/N) only (may not be taken for a grade). Offered each term. Prerequisite: permission of the instructor.","0","","","","","","Greg W. Muth","","S","200","1","Independent Research (.25, .5, 1.0)","","297","","True","permission of the instructor.","N","3","","","O","20253","Independent Research","Research","2025"
